id_dokumen,sumber,url,judul,konten,tanggal_terbit,url_thumbnail
doc_00110,Detik-Inet,https://inet.detik.com/games-news/d-4939506/cegah-corona-kini-main-pokemon-go-bisa-dari-rumah,"Cegah Corona, Kini Main Pokemon Go Bisa Dari Rumah","Terus meningkatnya penyebaran virus corona membuat masyarakat disarankan menghindari aktivitas di tempat umum. Hal itulah yang dilakukan pengembangPokemon Go, yang melakukan sedikit perubahan di game tersebut agar bisa dimainkan dari rumah.
Pokemon Go sejatinya adalah game yang mengajak para pemainnya untuk keluar rumah dan mengunjungi tempat-tempat tertentu untuk mendapat pokemon baru ataupun merebut gym milik tim lain.
Namun penyebaran virus corona membuat Nianticharus memodifikasi sebagian mekanika game tersebut. Tujuannya adalah agar para pemainnya bisa tetap memainkan Pokemon Go dari dalam rumah, tentunya sampai batas tertentu.
Perubahan tersebut salah satunya adalah dengan meningkatkan jumlah habitat pokemon baru agar pemain tetap bisa menemukan pokemon meski sedang berada di rumah, demikian dikutip detikINET dari Ubergizmo, Minggu (15/3/2020).
Niantic pun mendiskon harga item Incense sebesar 99% agar pemain bisa menggunakan item itu untuk meningkatkan kemunculan pokemon di sekitarnya, termasuk menambah durasi item tersebut menjadi satu jam. Lalu mereka pun mengurangi jarak yang dibutuhkan untuk menetaskan telur menjadi setengahnya.
Perlu diingat, ini hanyalah perubahan sementara dan Niantic akan mengembalikan mekanika game ke normal saat situasi penyebaran virus corona sudah kembali normal.
""Kami membuat perubahan ini berdasarkan situasi kesehatan global saat ini, kami juga mengajak pemain untuk membuat keputusan tujuan mereka dan apa yang mau dilakukan untuk kepentingan kesehatan mereka dan kesehatan orang di sekitarnya,"" tulis Niantic dalam blog resminya.",15 Mar 2020 07:37,https://akcdn.detik.net.id/community/media/visual/2016/07/09/16df53e8-06b8-44c4-9267-7cc9a9d42eb2_169.jpg?w=700&q=90
doc_00111,Detik-Inet,https://inet.detik.com/games-news/d-4941620/5-game-untuk-temani-kamu-yang-diam-di-rumah-karena-corona,5 Game untuk Temani Kamu yang Diam di Rumah karena Corona,N/A,16 Mar 2020 22:16,https://akcdn.detik.net.id/community/media/visual/2019/09/19/d5f683f2-6bcb-4429-bf9c-b0a54c0d68dd.jpeg?w=700&q=90
doc_00112,Detik-Inet,https://inet.detik.com/games-news/d-4941622/steam-bikin-rekor-baru-setelah-20-juta-orang-online-bareng,Steam Bikin Rekor Baru Setelah 20 Juta Orang Online Bareng,"Virus coronamemaksa semakin banyak orang untuk mempraktekkansocial distancingdan tetap tinggal di rumah. Salah satu dampaknya, platform gaming sepertiSteamsemakin dibanjiri banyak orang yang ingin menghilangkan rasa bosan.
Bahkan Steam baru-baru ini memecahkan rekor setelah lebih dari 20 juta orang online bareng untuk pertama kalinya pada hari Minggu (15/3). Dikutip detikINET dariThe Verge, Senin (16/3/2020), pada puncaknya ada 20.313.451 orang yang online dalam waktu yang sama di Steam.
Data tersebut diambil dari statistik yang direkam oleh SteamDB. Dari 20,3 juta orang yang online bersama di Steam, 6,5 jutanya aktif bermain game.
Jumlah ini tidak hanya fenomenal karena angkanya yang besar, tapi juga durasi dan kecepatannya dalam mencapai angka ini. Karena baru bulan lalu Steam membuat rekor setelah lebih dari 19 juta pemain online bersamaan.
Padahal pada minggu lalu, tidak ada game baru yang sangat dinanti-nantikan gamer. Mereka justru memainkan game-game yang memang telah lama menjadi favorit seperti Counter Strike: Global Offensive yang dimainkan 1.024.845 gamer pada puncaknya.
Angka tersebut menjadikan CS:GO sebagai game paling populer pada akhir pekan lalu. Jumlah pemain yang mencapai lebih dari satu juta juga merupakan rekor bagi game tersebut karena untuk pertama kalinya mereka melewati jumlah pemain hingga tujuh digit.
Sementara itu game-game lainnya yang banyak dimainkan gamer di Steam pada minggu lalu antara lain Dota 2 (700 ribu), PUBG (515 ribu), Rainbow Six Siege (196 ribu), Path of Exile (115 ribu) dan Grand Theft Auto V (173 ribu).",16 Mar 2020 21:23,https://akcdn.detik.net.id/community/media/visual/2019/06/26/ea194c35-f74f-4053-8ec2-ecad20b662ae.jpeg?w=700&q=90
doc_00113,Detik-Inet,https://inet.detik.com/games-news/d-4942030/microsoft-akhirnya-ungkap-spesifikasi-lengkap-xbox-series-x,Microsoft Akhirnya Ungkap Spesifikasi Lengkap Xbox Series X,"Penantian akhir usai dan rasa penasaran pun terjawab,Microsoftakhirnya membeberkan jeroan dari konsol terbarunya. Berikut ini spesifikasiXbox Series X.
Konsol ini ditenagai prosesor delapan inti AMD Zen 2 CPU yang punya kecepatan 3,8 GHz dan fabrikasi 7 nm. Tersemat GPU AMD RDNA2 yang memiliki 12 teraflop, dengan 52 unit komputasi berjalan, yang masing-masing berjalan di 1,825 GHz.
Microsoft membekalinya dengan RAM 16 GB, yang dibagi untuk GPU 10 GB, OS 2,5 GB dan sistem 3,5 GB. Tersemat 1 TB NVME SSD dan diberikan opsi memperluas penyimpanan melalui kartu ekspansi 1 TB melalui port USB 3.2 di bagian belakang.
Konsol ini dapat memainkan game 4K pada 60fps hingga 120 fps. Selain itu dijanjikan waktu loading dan resume yang cepat.
Bicara dimensi, Xbox Series X hadir dengan ukuran bodi 151 x 151 x 301 mm. Bila dibandingkan dengan pendahulunya, Xbox One X ukurannya 299.7mm x 238.7mm x 60.9mm.
Konsol ini siap melenggang di pasaran akhir tahun 2020 ini.",17 Mar 2020 08:32,https://akcdn.detik.net.id/community/media/visual/2020/03/17/ad860872-365d-4f96-acb7-d0f77fb602b2_169.png?w=700&q=90
doc_00114,Detik-Inet,https://inet.detik.com/games-news/d-4943906/sony-segera-ungkap-detail-spesifikasi-ps5,Sony Segera Ungkap Detail Spesifikasi PS5,"Sonyberencana mengungkap lebih banyak informasi mengenai hardware yang dipakai diPlayStation 5(PS5) dalam waktu dekat.
Informasi tersebut bakal diungkap dalam sebuah acara live streaming yang diadakan pada 18 Maret 2020 pukul 9 pagi waktu setempat, atau Kamis (19/3/2020) malam WIB. Acara tersebut bakal ditayangkan di blog resmi PlayStation.
[Gambas:Twitter]
Acara ini adalah kelanjutan dari pernyataan Sony yang mengkonfirmasi nama PlayStation 5 pada Oktober 2020 lalu, beberapa informasi kecil soal spesifikasi konsol yang bakal dirilis pada akhir 2020 tersebut.
Sejauh ini, Sony sudah mengkonfirmasi kalau PS5 bakal menggunakan CPU delapan core yang berbasis pada CPU AMD Ryzen generasi ke-3, serta GPU custom dengan arsitektur AMD Radeon Navi.
Konsol ini juga bakal mendukung resolusi 8K, 3D audio, 4K 120Hz, opsi konsumsi daya rendah, serta SSD super kencang sebagai storagenya, demikian dikutip detikINET dari The Verge, Rabu (18/3/2020).
Acara Sony ini diadakan beberapa hari setelah Microsoft mengungkap spesifikasi lengkap dari Xbox Series X. Konsol Microsoft tersebut bakal menggunakan CPU custom AMD Zen 2 dengan delapan core berkecepatan 3,8Ghz, serta GPU custom dengan arsitektur AMD RDNA 12 teraflops dan 52 compute unit dengan kecepatan masing-masing 1,825GHz.
Lalu ada juga RAM GDDR6 16GB dengan storage SSD NVMe 1TB yang bisa ditambah hingga 1TB.",18 Mar 2020 12:37,https://akcdn.detik.net.id/community/media/visual/2020/01/07/e635bb94-8ce9-40c7-92c3-2ea85924d825_169.jpeg?w=700&q=90
doc_00115,Detik-Inet,https://inet.detik.com/games-news/d-4944793/suka-diremehin-jadi-gamer-wanita-ini-kata-gamer-audrey-ff,Suka Diremehin Jadi Gamer Wanita? Ini Kata Gamer Audrey FF,"Menjadi seorang content creator bukanlah hal yang mudah untuk dilakukan. Apalagi menjadi seorang content creator gaming, mengingat bahwa industri game di Indonesia masih dipandang sebelah mata oleh banyak pihak.
Ridha Audrey atau yang lebih dikenal Audrey FF, salah satu content creator gaming mengungkapkan pada awalnya banyak hal yang menghambat dirinya untuk menjadi seorang gamer. Mulai dari orang tua hingga cibiran dari para gamers cowok.
""Aku tuh sering dimarahin sama orangtua karena sehari-hari cuma main game, lalu kita (gamers cewek) itu sering dianggap parasit oleh gamers cowok,"" ungkap Audrey dalam acara Waktu Indonesia Bikin Konten, di Jakarta, Rabu (18/3/2020).
""Aku beruntung, dulu aku menemukan komunitas gaming wanita, kemudian sering main bareng dan akhirnya bikinlah tim profesional. Nah dari situ aku mulai menangin beberapa turnamen kemudian jadi content creator live streaming game setelah pensiun saat ini,"" ujar Audrey.
Menurutnya, untuk menjadi seorang content creator gaming atau streamer game butuh juga melihat kesempatan yang ada. Audrey pun mengungkapkan pada awalnya ia menemukan komunitas gaming wanita secara tidak sengaja.
Setelah bercerita perjalanannya sebagai content creator, Audrey membagikan tips agar konten video lebih menarik perhatian. Selain itu ia juga memberikan beberapa hal yang penting untuk disiapkan.
""Pertama harus main bareng dengan teman, saat main bareng kita tuh punya chemistry sehingga bisa menemukan momen-momen lucu. Nah, dari momen-momen lucu atau konten lucu itu ternyata bisa menjadi konten yang menarik untuk ditonton oleh banyak orang,"" ungkap Audrey.
Audrey menjelaskan juga, bahwa isi dari konten bisa mencari yang sedang viral saat ini. Usahakan juga agar bisa memiliki persiapan yang baik dari segi perangkat untuk membuat konten.
""Selain itu buatlah konten yang sedang viral, seperti KKN Desa Penari atau aplikasi Joget. Tentunya persiapan seperti alat-alat elektronik pendukung video juga penting, contohnya PC gaming, mic, dan webcam,"" jelas Audrey.
Audrey pun mengungkapkan sebuah perangkat elektronik yang sering rusak saat membuat video. Tak cemas, ia pun bilang akan membelinya lewat Shopee.
""Paling sering rusak sih mouse soalnya kan suka marah-marah pas kita main dan bikin video. Nanti aku beli deh lewat Shopee,"" ujar Audrey.
Audrey menutup ceritanya dengan menjawab pertanyaan terakhir seputar kampanye 4.4 Mega Elektronik Sale dari Shoppe yang sedang berjalan.
""Senang banget pastinya apalagi aku kan lagi bikin konten tentang merakit PC sekarang, pasti diskonnya gede dan barang elektronik yang ada di kampanye Shopee ini bakalan aku beli,"" pungkas Audrey.",18 Mar 2020 21:31,https://akcdn.detik.net.id/community/media/visual/2020/03/18/bfcd3706-e887-4ae1-8a6f-a5c4799d43fe_169.jpeg?w=700&q=90
doc_00116,Detik-Inet,https://inet.detik.com/games-news/d-4945267/lebih-dari-1-000-gamer-siap-tarung-di-vivo-esports-cup-2020,Lebih dari 1.000 Gamer Siap Tarung di vivo Esports Cup 2020,"Sejak resmi dibuka pada 10 Maret 2020 lalu, vivo Esports Cup 2020 mendapat respons positif dari masyarakat Indonesia. Hal ini bisa dilihat dari banyaknya jumlah peserta yang telah mendaftar dalam turnamen ini yang mencapai lebih dari 1.000 peserta.
Terdapat dua kategori permainan yang dilombakan dalam vivo Esports Cup 2020 yaitu Mobile Legend Bang Bang dan PUBG Mobile. Melihat tingginya antusias terhadap vivo Esports Cup 2020, Senior Brand Directorvivo IndonesiaEdy Kusuma berharap turnamen ini dapat menjadi kegiatan positif.
""Melihat antusias yang positif terhadap vivo Esports Cup 2020, kami harap menjadi sebuah kegiatan positif yang juga membawa dampak yang baik untuk para pemain muda di Indonesia. Kami harap juga seluruh tim yang telah mendaftar dan terpilih nantinya siap bertarung,"" ungkap Edy dalam keterangan tertulis, Kamis (19/3/2020).
Edy menambahkan vivo Esports Cup 2020 merupakan salah satu komitmen vivo dalam mendukung industri game mobile, khususnya industrieSport. Turnamen ini bisa menjadi peluang bagi para gamers di seluruh kota di Indonesia untuk bersaing serta menunjukkan kemampuannya di turnamen regional.
Setiap tim yang terpilih dari setiap regional nantinya akan bertarung online di babak kualifikasi. Terdapat 6 regional pulau pada vivo Esports Cup 2020 yaitu Sumatera, Jawa, Kalimantan, Sulawesi, Bali NTT NTB dan Papua Maluku. Turnamen online ini tentunya dapat disaksikan langsung dari channel resmi milik Youtube vivo Indonesia.
Untuk mendukung vivo Esports Cup 2020, vivo juga menghadirkan varian smartphone terbarunya vivo V19 yang ditenagai prosesor Qualcomm Snapdragon 675 AIE Octacore serta memiliki dua varian kapasitas, RAM 8GB dengan ROM 128GB atau 256GB.
Tak hanya itu, vivo V19 juga dilengkapi dengan vivo Multi Turbo, Game Turbo, Net Turbo, Cooling Turbo, dan ART ++ Turbo, teknologi permainan khusus yang tentunya akan membuat pengalaman mobile gaming menjadi lebih lancar dan nyaman.
Bagi kamu yang ingin ikut serta dalam turnamen vivo Esports Cup 2020, segera daftarkan diri di website resmi www.vivoesportscup.com. Kunjungi juga websitenya untuk keterangan lebih lanjut.
PendaftaranvivoEsports Cup 2020 masih dibuka hingga 25 Maret 2020. Jadi, tunggu apalagi? Daftarkan tim kamu di vivo Esports Cup 2020 dan raih hadiah total Rp 200 juta.",19 Mar 2020 11:00,https://akcdn.detik.net.id/community/media/visual/2020/03/19/80fb9c4e-998e-4c62-8571-9e391887c6cd_169.jpeg?w=700&q=90
doc_00117,Detik-Inet,https://inet.detik.com/games-news/d-4945578/sony-ungkap-spesifikasi-lengkap-ps5,Sony Ungkap Spesifikasi Lengkap PS5,"Sonyakhirnya mengungkap spesifikasi lengkapPlayStation 5(PS5), konsol yang akan mereka rilis pada akhir 2020 ini. Seperti apa speknya?
PS5 akan menggunakan CPU custom delapan core dengan arsitektur AMD Zen 2, yang masing-masing corenya punya kecepatan 3,5 GHz. Sementara GPU-nya menggunakan arsitektur AMD RDNA 2 dengan 36 compute unit dengan masing-masing kecepatannya 2,23 GHz, yang menjanjikan kekuatan 10,28 teraflop.
RAM yang dipakai berkapasitas 16GB GDDR6 dan SSD custom berkapasitas 825 GB. SSD inilah yang membuat Sony bisa menjanjikan loading game yang super kencang di PS5, demikian dikutip detikINET dari The Verge, Kamis (19/3/2020).
Pada akhir 2019 lalu, Sony sempat memamerkan loading game Spider-Man dengan konsol terbarunya ini. Pada PS5, game tersebut bisa dibuka dalam waktu kurang dari sedetik, sementara di PS4 membutuhkan sekitar delapan detik.
Bos Hardware PlayStation Mark Cerny menyebut SSD di PS5 bisa membaca data sebesar 5GB dalam satu detik, berbanding 20 detik untuk membaca data 1GB di PS4. Custom SSD yang ada di PS5 ini sebenarnya adalah SSD NVMe, namun yang memenuhi syarat Sony, yaitu berkecepatan setidaknya 5,5GB/s.
Storage di PS5 juga bisa ditambahkan menggunakan perangkat semacam flash disk, namun storage tambahan ini hanya bisa dipakai memainkan game PS4, karena game game PS5 didesain untuk berjalan di storage dengan kecepatan yang jauh lebih tinggi.
Ya, PS5 memang bakal kompatibel dengan semua game PS4 tanpa perlu adanya perubahan dari sisi developer, meski developer juga tetap bisa melakukan perubahan di gamenya itu agar bisa berfungsi lebih baik diPS5.",19 Mar 2020 14:45,https://akcdn.detik.net.id/community/media/visual/2020/01/07/e635bb94-8ce9-40c7-92c3-2ea85924d825_169.jpeg?w=700&q=90
doc_00118,Detik-Inet,https://inet.detik.com/games-news/d-4946240/asyik-setidaknya-100-game-ps4-kompatibel-dengan-ps5,Asyik! Setidaknya 100 Game PS4 Kompatibel dengan PS5,"Sony memastikan kalauPlayStation 5bakal mendukung hampir semuagamepopuler diPlayStation 4saat nanti diluncurkan.
Hal ini dipastikan oleh Mark Cerny, lead system architectPS5, saat mempresentasikan informasi lengkap mengenai konsol terbaru Sony itu. Ia menyebut hasil tes kompatibilitas terhadap game PS4 di PS5 hasilnya sangat bagus.
""Kami baru-baru ini menjajal 100 game top PlayStation 4 dari jumlah waktu bermain, dan kami memperkirakan hampir semuanya bisa dimainkan saat peluncuran PlayStation 5,"" ujar Cerny.
Sony sendiri memang sudah memastikan kalau konsol barunya itu bakal mempunyai kompatibilitas ke belakang, meski mereka belum menjelaskan bagaimana cara kerjanya. Namun menurut Cerny, hal itu dimungkinkan karena Sony membenamkan chipset dari konsol generasi sebelumnya ke dalam PS5.
Langkah serupa pernah mereka lakukan pada sejumlah model PlayStation 3. Kelemahan trik ini adalah biaya yang menurut Cerny sangat tinggi. Namun menurutnya trik ini lebih baik ketimbang membenamkan logic dari konsol sebelumnya ke chip di konsol baru.
Dalam beberapa bulan terakhir, Sony sudah membeberkan banyak informasi mengenai PS5, seperti dukungan resolusi 8K, 3D audio, 4K gaming di 120Hz, SSD super kencang, dan penggunaan CPU AMD Zen 2 dan GPU AMD RDNA 2.",19 Mar 2020 22:20,https://akcdn.detik.net.id/community/media/visual/2020/03/19/ac1bfb79-3dea-4ed1-8189-6939ecb1a0ea_169.jpeg?w=700&q=90
doc_00119,Detik-Inet,https://inet.detik.com/games-news/d-4947048/social-distancing-sempat-bikin-game-fortnite-down,Social Distancing Sempat Bikin Game Fortnite Down,"Di tengah pandemiCOVID-19, beberapa game populer sempat down karena banyak orang yang diminta untuk diam di rumah mencari hiburan dengan bermain game. Hal ini terjadi padaFortnite.
Pekan ini, gamer Fortnite kesulitan mengakses game tersebut karena terlalu banyak orang memainkannya di waktu bersamaan. Kampanyesocial distancingmembuat kapasitas server Fortnite kewalahan dan membludak.
Epic Gamesselaku developer dan publisher game ini mengumumkan di Twitter bahwa mereka langsung menginvestigasi sejumlah isu yang dilaporkan para pemain.
""Kami menginvestigasi masalah login, matchmaking, Item Shop, dan layanan Fortnite lainnya. Kami akan memberikan update ketika masalah ini selesai,"" kata Epic Games.
Para pemain juga melaporkan masalah ini di situs DownDetector.com pada Selasa (17/3) sore, sementara pemain lainnya juga melaporkan masalah serupa di Twitter.
""Semua orang main game karena sekolah ditutup, game-nya kewalahan,"" tulis salah satu pengguna.
""Karantina, gak bisa main Fortnite, corona sudah membunuhku,"" komentar pengguna lainnya.
Meski demikian ada juga pemain yang memberi dukungan pada Epic Games agar mereka bisa menangani masalah ini dengan segera.
""Bisakah orang-orang berhenti komplain. Bayangkan ada berapa banyak masalah di game ini sekarang? Memang ini mengganggu, tapi kalian juga harus apresiasi mereka mati-matian bekerja dari rumah di tengah wabah COVID-19,"" tulis pengguna tersebut.
Saat ini akses game Fortnite sudah kembali normal, dan para pemain bisa mengaksesnya dengan lancar. Selain Fortnite, sebelumnya pada Januari lalu ada PUBG yang servernya juga sempat tumbang.
Game for Peace, PUBG Mobile versi pasar China, kewalahan karena lonjakan trafik yang diterima server miliknya selama libur Imlek yang diperpanjang karena kebijakan social distancing untuk meredam penyebaran virus corona. Gamer mengeluhkan tak bisa login ke Game for Peace.
Hashtag #GameForPeaceCollapsed bahkan sempat jadi trending terpopuler di media sosial China, Weibo. Tencent pun bergegas untuk meningkatkan kapasitas di servernya.",20 Mar 2020 15:34,https://akcdn.detik.net.id/community/media/visual/2019/04/25/6777cb75-99b7-4de9-a149-c8c7be26f05d.jpeg?w=700&q=90
doc_00120,Detik-Inet,https://inet.detik.com/games-news/d-4948621/15-game-gratis-buat-temani-kamu-selama-dirumahaja,15 Game Gratis Buat Temani Kamu Selama #dirumahaja,N/A,22 Mar 2020 08:03,https://akcdn.detik.net.id/community/media/visual/2018/03/22/ca7b1eb8-2fdf-4d75-85e7-5f94e564e190.jpeg?w=700&q=90
doc_00121,Detik-Inet,https://inet.detik.com/games-news/d-4948955/ajaibnya-pubg-mobile-dibuat-hanya-dalam-4-bulan,"Ajaibnya PUBG Mobile, Dibuat Hanya dalam 4 Bulan","Dua tahun lalu,Tencent GamesmeluncurkanPUBG Mobiledengan ukuran 2 GB dengan pengalaman yang sama dengan Player Unknown's Battlegrounds di PC. Mungkin tidak disangka jika game ini begitu populer sekarang, jika merunut ke belakang, game ini hanya makan waktu 4 bulan dalam proses pembuatannya.Kokbisa?
KetikaTencentbaru-baru merayakan ulang tahun kedua PUBG, direktur Rick Li mulai membicarakan pembuatan PUBG Mobile. ""Kita bisa melihat semakin populernya kategori ini di pasar permainan, jadi proyek ini dimulai sesuai urgensi,"" kata Li seperti dikutip dari Polygon.
Reaksi dari pemain terhadap PUBG mendorong Tencent terpacu untuk mengembangkan game dengan cepat. Dengan segera, mereka mengumpulkan talenta top di studio untuk berfokus dalam proyek ini. Ajaibnya, mereka hanya butuh waktu empat bulan.
""Itu adalahMission: Impossiblesetiap hari,"" ujarnya.
Masih kata Li, tantangan terbesar adalah mendapatkan gambar dan lingkungan yang sesuai dengan game asli untuk dimuat serta dapat ditampilkan lancar di perangkat mobile.
""Kami perlu mengatasi banyak kesulitan teknis dan artistik, termasuk HDR real-time lighting, simulating ballistic trajectories, dan sebagainya,"" sambungnya.
Di luar tim utama PUBG Mobile, Lightspeed & Quantum juga membentuk tim khusus untuk setiap fitur yang sulit. Yang dikerjakan terlebih dahulu adalah untuk perangkat high-end dan kemudian mengoptimalkan model yang ada di seri bawahnya. Fokusnya adalah, Tencent ingin permainan terlihat terbaik tetapi tetap menyenangkan dan lancar untuk pemain dengan ponsel low-end sekalipun.
""Banyak pengguna di China tidak memiliki akses ke PC atau konsol, tetapi mereka masih ingin bermain game,"" kata Neo Liu, Head of Games Publishing Tencent di Amerika Utara dan Selatan.
""Tapi akhir-akhir ini, semua orang harus memiliki perangkat pintar. Jadi ini adalah cara yang baik bagi kita untuk mengakses sejumlah besar pengguna sambil menghadirkan pengalaman bermain game terbaik bagi mereka,"" tandasnya.",22 Mar 2020 15:16,https://akcdn.detik.net.id/community/media/visual/2019/03/25/5794e580-cbce-4061-afb0-34dad4802710.png?w=700&q=90
doc_00122,Detik-Inet,https://inet.detik.com/games-news/d-4950136/5-game-menghibur-selingan-kerja-dari-rumah,5 Game Menghibur Selingan Kerja dari Rumah,"Kendatikerja dari rumahlantaran wabahvirus corona, luangkan waktu sejenak untuk bersantai. Nah deretan game ini bisa menjadi selingan menghibur saat mengerjakan tugas kantor.
Game ini dapat diunduh secara gratis diAndroidmaupuniOS. Bermainnya pun tidak sulit.
Kamu hanya perlu mengarahkan cacing untuk mencari makan. Tapi jangan sampai tertabrak cacing lain atau pembatas.
Kumpulkan koin untuk memodifikasi tampilan cacing kamu biar lebih trendi. Selain itu cari ramuan-ramuan yang membuat cacing mu lebuh mudah melahab semua makanan yang ada.
Link:Android-iOS
Kalau kamu salah satu fansTahilalats, jangan lewatkan game buatan Agate, developer anak negeri. Kamu hanya cukup mencari dua karakter Tahilalats yang identik.
Tapi keduanya harus terhubung tanpa ada ada halangan ikon lain. Terdengar mudah, tapi tidak demikian ferguso... Emoticon Tahilalats siap bikin kamu geregetan.
Link:Android-iOS
Permainan asah otak dengan jawaban yang sama sekali tidak akan terbayangkan. Game ini penuh dengan lelucon, sangat menyenangkan dan akan mengasah daya imajinasimu.
Link:Android-iOS
Punya cita-cita jadi interior desain? atau punya impian mendandani rumah tapi belum cukup dana? coba mainkan game ini.
Kamu akan ditantang memodifikasi ruangan. Bila desain yang kami buat lebih menarik, maka akan dapat poin.
Link:Android-iOS
Kamu hanya perlu membimbing burung origami saat terbang di udara dan menangkap bola yang jatih dari langit. Tapi hati-hati ada bola yang akan mengejar dan mematikan si burung origami.
Link:Android-iOS",23 Mar 2020 17:01,https://akcdn.detik.net.id/community/media/visual/2019/01/14/e04cfc86-e725-4790-a2fa-f03a85fc2bf3_169.jpeg?w=700&q=90
doc_00123,Detik-Inet,https://inet.detik.com/games-news/d-4950290/polandia-kasih-game-gratis-agar-remaja-nurut-social-distancing,Polandia Kasih Game Gratis Agar Remaja Nurut Social Distancing,"Polandia berupaya membuat anak-anak muda mematuhi aturan social distancing selama masa pandemiCOVID-19dengan menyediakan situs khusus yang isinya game-game gratis untuk hiburan di rumah.
Seperti dikutip dariMashable, Grarantanna.pl, nama situs tersebut, juga menjadi rumah bagi server yang sengaja dibuat untuk menampung anak-anak muda Polandia bermain gameMinecraft.
Kementerian Komunikasi dan Informatika Polandia sengaja menyediakan server Minecraft khusus yang di dalamnya juga tersedia berbagai kegiatan interaktif termasuk turnamen bagi semua pemain.
Menariknya lagi, situs ini dijadikan sebagai wadah sosialisasi wabah. Dalam dunia Minecraft tersebut, pemerintah Polandia memberikan imbauan sekaligus pesan mengenai kesehatan dan instruksi bagi anak-anak muda agar tetap diam di rumah demi meredam penyebaran virus.
Tak hanya itu, pemerintah Polandia menggelar turnamen bagi siapa saja yang bisa membuat replika bangunan dengan gaya arsitektur menarik. Setiap pemain sudah diberikan lahan virtual di dalam game serta bahan bangunan yang dibutuhkan di dalam game untuk melakukannya.
Selain Minecraft, situs ini dijadikan tempat bagi pemerintah Polandia menggelar beragam edukasi online, puzzle dan beragam kuis terkait sejarah Polandia.",23 Mar 2020 18:11,https://akcdn.detik.net.id/community/media/visual/2020/03/23/2ac720d8-0f09-48fc-b855-9a7a745ea366.png?w=700&q=90
