id_dokumen,sumber,url,judul,konten,tanggal_terbit,url_thumbnail
doc_00291,Detik-Inet,https://inet.detik.com/games-news/d-5060634/google-buka-platform-maps-untuk-pengembang-game,Google Buka Platform Maps untuk Pengembang Game,"GooglemembukaGoogle MapsPlatform ke publik, yang artinya pengembanggamebisa menggunakan data yang ada di peta digital tersebut di game buatannya.
Artinyapengembangbisa membuat game semacam Pokemon Go dengan memanfaatkan data dari peta digital Google tersebut. Pokemon Go dibuat oleh Niantic, yang sebelumnya adalah startup binaan Google.
Data ini sebenarnya sudah dibuka oleh Google sejak Maret 2018, namun ketersediaannya terbatas pada beberapa studio game. Sejauh ini baru ada 10 game yang dibuat dengan memanfaatkan platform Maps ini.
Langkah Google untuk mempublikasikan data ini dilakukan karena banyak studio game indie dan berbagai pengembang lain menyatakan ketertarikannya untuk memakai platform tersebut. Jadi Google pun kemudian meningkatkan infrastrukturnya agar para developer bisa menggunakan data tersebut.
Tak cuma itu, Google sampai menawarkan software development kit (SDK) untuk mempermudah developer mengembangkan gamenya sendiri, serupa dengan yang dilakukan Unity lewat game engine-nya, demikian dikutip detikINET dari The Verge, Jumat (19/6/2020).
Lewat platform ini, developer game bisa melakukan hal-hal menarik seperti mentransformasi lokasi di dunia nyata, atau pusat keramaian yang ada di Maps ke dalam gamenya. Google pun menambahkan sejumlah fitur baru ke platform.
Salah satunya adalah dengan menampilkan gambar dengan detail lebih tinggi untuk objek yang lokasinya berdekatan dengan pemain, sementara objek yang lebih jauh akan ditampilkan dengan tingkat detail yang lebih rendah. Tujuannya adalah untuk meringankan beban kerja sistem yang kemudian bisa mengurangi konsumsi daya baterai.",19 Jun 2020 19:53,https://akcdn.detik.net.id/community/media/visual/2020/03/05/ee1c47f1-2d6f-4d41-a272-6a2535c656c1_169.jpeg?w=700&q=90
doc_00292,Detik-Inet,https://inet.detik.com/games-news/d-5060672/kerjasama-tiktok-fans-evos-esport-bisa-tukar-poin-dengan-voucher,"Kerjasama TikTok, Fans EVOS eSport Bisa Tukar Poin dengan Voucher","Kerjasama bareng TikTok, fansEVOS eSportbisa menukarkan poin TikTok Treats mereka menjadi Evos Membership Point yang bisa dipakai beli voucher atau kuota.
Hartman Harris Co-Founder Evos eSport mengungkapkan dalam konferensi pers bahwa segmen TikTok terbilang sejalan dengan Evos di mana banyak milenial dengan jiwa yang penuh gairah. Pihaknya juga sudah lama mengikutiTikToksejak lama ketika masih booming di negeri asalnya, China.
""EVOS sendiri kita memang story teller, kita sorot pemain kita atau EVOS tuh dari mana asalnya dan kita itu apa. TikTok adalah platform yang saya rasa bergairah dan jiwanya milenial. Kita mikir orang atau fans kita sudah agak lelah dengan konten sebelumnya, kalau TikTok kan emang short term video, apalagiattentionmilenial lebih pendek jadi mereka nyarinya TikTok,"" ujarnya.
Selain itu, EVOS juga ikutan membuat challenge dan ternyata hal ini sangat membantu dan memberikan respon yang baik. Seperti diketahui, dari segi video streaming, EVOS sudah pasti mengalami peningkatan traffic yang tinggi. Akan tetapi, EVOS juga mengalami 'bonus' bantuan peningkatan traffic merchandise karena TikTok.
""Sebenarnya kita jarang jualan, kerjaan kita menghibur dan menginspirasi. Salah satu hal yang kita jual, merchandise,surprisingly not too bad. Ada penurunan cuma sedikit dan kita baru luncurkan EVOS Membership Subscription Rp 450 ribu per tahun. Kita pas awal agak gugup apakah di masa ini ada orang yang beli tapi Alhamdulillah tiap harisold out, ditambah dengan bantuan TikTok,"" tuturnya.
""Karena penjualan cepatsold out, kita untuk kasih mereka lah dengan challenge TikTok. Ada EMP (EVOS Membership Points) untuk beli ditukar voucher atau kuota,"" tandasnya.",19 Jun 2020 22:00,https://akcdn.detik.net.id/community/media/visual/2019/11/08/b9d91650-30bd-4241-8ab7-92a25136953e_169.jpeg?w=700&q=90
doc_00293,Detik-Inet,https://inet.detik.com/games-news/d-5061408/harga-game-the-last-of-us-2-yang-resmi-meluncur-di-ps4,Harga Game The Last of Us 2 yang Resmi Meluncur di PS4,"GameThe Last of Us 2akhirnya rilis di Indonesia untuk PS4. Permainan ini merupakan adaptasi dari film dengan judul yang sama dan bertemakan petualangan horor.
Permainan The Last of Us 2 sendiri merupakan kolaborasi dari Sony Computer Entertainment dan Naughty Dog. Pada awalnya, game direncanakan rilis pada 21 Februari lalu dan mundur karena adanya virus corona.
Seri ini dipatok dengan harga USD 229.99 atau setara dengan Rp 3.219.860 (kurs Rp 14.000). Dengan harga tersebut, kamu bisa mendapatkan replika ransel Ellie, buku seni mini 48 halaman, hingga soundtrack digital
Edisi ini dijual dengan harga USD 169.99 atau setara dengan Rp 2.379.860 (kurs Rp 14.000). Selain permainan The Last of Us, kamu bisa mendapatkan replika gelang Ellie, soundtrack digital, hingga buku seni mini 48 halaman.
Edisi ini dijual dengan harga USD 79.99 atau setara dengan Rp 1.119.860 (kurs Rp 14.000). Kamu juga akan mendapatkan tema dinamis PS4, set 6 avatar, hingga soundtrack digital.
The Last of Us 2seri ini dijual dengan harga USD 59.99 atau setara dengan Rp 839.860 (kurs Rp 14.000). Paket ini juga dilengkapi dengan tema dinamis PS4, set 6 avatar, soundtrack digital, dan buku seni mini digital.",20 Jun 2020 15:29,https://akcdn.detik.net.id/community/media/visual/2020/05/01/e59e1592-6e29-4165-8aee-b766461a4540_43.jpeg?w=700&q=90
doc_00294,Detik-Inet,https://inet.detik.com/games-news/d-5063296/kejutan-crash-bandicoot-4-akan-diumumkan-hari-ini,Kejutan! Crash Bandicoot 4 Akan Diumumkan Hari Ini,"PenggemarCrash Bandicootsiap-siap mendapatkan kejutan. Setelah sekian lamanya akhirnya serial game ini akan mendapatkan sekuel modern, bukan sekedar remaster edisi lawas atau game balapan.
DikutipdetikINETdari Engadget, Senin (22/6/2020) Toys for Bob dan Activision akan mengungkap Crash Bandicoot 4: It's About Time pada hari ini pukul 11.00 waktu Amerika Serikat bagian timur.
Pengumuman ini disampaikan lewat akun Twitter Crash Bandicoot bersamaan dengan video teaser. Video teaser ini tidak memperlihatkan banyak detail, tapi jangan khawatir karena detail sudah dibocorkan sebelumnya.
[Gambas:Twitter]
Pengumuman ini memang dibuatActivisionsetelah muncul bocoran tentang Crash Bandicoot 4 dari situs Taiwan Digital Game Rating Commitee serta beberapa screenshot dari trailer game ini.
""Crash sedang bersantai dan menjelajahi pulaunya di waktunya, 1998, ketika ia menemukan topeng misterius tersembunyi di gua, Lani-Loli. Topeng ini adalah salah satu Quantum Masks dan ternyata mengenal Aku-Aku, topeng teman Crash!"" tulis bocoran deskripsi Crash Bandicoot 4.
""Dengan kembalinya Quantum Masks dan munculnya Quantum Rift dekat jagoan kita, mereka memutuskan untuk menuju waktu dan dimensi yang berbeda untuk menghentikan siapapun yang bertanggung jawab,"" sambungnya.
Dari screenshot bocoran yang beredar, sepertinya Crash Bandicoot 4 tidak akan jauh berbeda dibanding pendahulunya. Gameplay-nya mencakup melarikan diri dengan sudut pandang kamera look-behind-you, peralatan aneh seperti jetpack, dan kembalinya Dr. Neo Cortex.
Screenshot ini juga memperlihatkan gaya visual baru yang berbeda dengan versi remaster Crash Bandicoot N. Sane Trilogy. Bocoran tersebut juga menyebut game ini akan meluncur pada 9 Oktober 2020 untuk platform PlayStation 4 dan Xbox One.
JikaCrash Bandicoot 4akan hadir untuk platform lain seperti PC atau Nintendo Switch, kemungkinan informasi ini akan diumumkan dalam event ini.",22 Jun 2020 15:11,https://akcdn.detik.net.id/community/media/visual/2017/07/04/db43ea26-a82d-4540-833f-d7edc066ab07_43.jpg?w=700&q=90
doc_00295,Detik-Inet,https://inet.detik.com/games-news/d-5064021/dukung-black-live-matter-mobil-polisi-hilang-di-fortnite,"Dukung Black Live Matter, Mobil Polisi Hilang di Fortnite","Beberapa pemain telah melaporkanEpic Gamestelah menghapus semua mobil polisi dari gameFortnitepada pembaruan terbarunya.
Hal tersebut rupanya dilakukan sebagai bentuk dukungan dari industri game atas gerakanBlack LIve Matteryang terjadi di Amerika Serikat karena kasus kekerasan oleh pihak polisi.
DilansirdetikINETdariEngadgetbelum ada tanggapan dari Epic tentang hilangnya mobil polisi pada game tersebut.
Seperti diketahui sebelumnya sudah ada beberapa game lainnya melakukan tindakan atas dukunganya terhadap gerakan tersebut seperti Call of Dutty: Modern yang turut memberikan dukungan melalui sebuah pesan protes di layar game tersebut. Selain itu ada juga GTA Online dan Read Dead Online melakukan shutdown dalam waktu sementara.
Epic tampaknya mengambil pendekatan yang lebih ringan denganFortnite, mengakui kemarahan tanpa secara eksplisit mengadvokasi untuk suatu alasan. Perusahaan sebelumnya menekankan bahwa hal tersebut tidak akan melarang pemain untuk berbicara politik.
Ini juga merupakan contoh terbaru dari tantangan yang dihadapi studio game saat menangani politik. Sebabnya pengembang game kerap memasukkan komentar politik baik dalam konten mereka atau dari para pemainnya.
Ubisoftmisalnya, menyatakan The Division 2 bersifat apolitis terlepas dari tema-tema yang mencolok. Epic mungkin berada dalam posisi yang sama sulitnya, karena ia memiliki banyak pemain dan pendapatan yang akan hilang jika hal tersebut memicu kehebohan.",22 Jun 2020 22:38,https://akcdn.detik.net.id/community/media/visual/2019/01/02/a0d5ca6d-f741-4a1e-9f2b-db72b7552e49_169.jpeg?w=700&q=90
doc_00296,Detik-Inet,https://inet.detik.com/games-news/d-5064326/waduh-acara-diskonan-ps4-dibubarkan-polisi,Waduh! Acara Diskonan PS4 Dibubarkan Polisi,"Sebuah toko diPrancismenjual PlayStation 4 (PS4) dengan diskon sangat besar. Dampaknya adalah ada keramaian di toko mereka dan sampai harus dibubarkan paksa oleh kepolisian setempat.
Toko tersebut adalah Lidl, dan kejadian ini terjadi di toko mereka yang berlokasi di Orgeval, sekitar 28 mil arah timur laut dari Paris. Mereka menjual PS4 versi 500GB dengan harga 95 euro atau sekitar USD 107, jauh lebih murah dibanding harga PS4 pada umumnya.
[Gambas:Twitter]
Pemberian diskon ini merupakan bagian dari acara pembukaan toko tersebut, dan sejumlah pegawai toko itu sudah mempromosikan diskonan tersebut lewat media sosial, yang kemudian menjadi viral.
Alhasil, acara pembukaan toko tersebut pun menjadi sangat ramai dengan orang-orang yang tak memperhatikan pembatasan jarak fisik. Padahal pemerintah Prancis sudah melarang tak boleh ada acara publik yang dihadiri lebih dari 10 orang dalam satu waktu.
Kemudian polisi pun didatangkan, dan dari video yang tersebar di media sosial, para polisi itu terlihat menggunakan semprotan merica untuk membubarkan keramaian. Menurut Olivier Dauvers, salah satu orang yang ada di acara tersebut, semprotan dari polisi itu membuat mata dan hidung terasa perih.
[Gambas:Twitter]
Dalam pernyataan resminya, Lidl France menyebut diskon itu adalah bagian dari proses cuci gudang mereka. Mereka pun berkilah diskon serupa di toko yang lain tak sampai menimbulkan keramaian seperti itu.
""Hari ini kami menganggap kalau kondisi keamanan tak bisa dipenuhi untuk tetap membuka supermarket. Penjualan PS4 ini pun dibatalkan secara permanen,"" kicau Lidl France lewat akun Twitter resminya.
Dikutip detikINET dari Techspot, Selasa (23/6/2020), peluncuranPS5dan Xbox Series X pada beberapa bulan mendatang membuat penjualan konsol yang ada saat ini menurun, dan memaksa sejumlah peritel memberikan diskon besar, seperti yang dilakukan oleh Lidl.",23 Jun 2020 08:34,https://akcdn.detik.net.id/community/media/visual/2018/09/20/46e4f279-9e73-4ab8-8d8a-5ffdbc316767_169.jpeg?w=700&q=90
doc_00297,Detik-Inet,https://inet.detik.com/games-news/d-5064471/switch-laris-bak-kacang-goreng-saham-nintendo-terus-naik,"Switch Laris bak Kacang Goreng, Saham Nintendo Terus Naik","Selamapandemi Coronaini banyak kondisi keuangan perusahaan yang memburuk karena tak bisa beroperasi. Namun nasibNintendoberbeda dengan perusahaan-perusahaan tersebut.
Saham Nintendo terus meningkat sejak pandemi Corona dimulai, dan saat ini valuasi Nintendo sudah mencapai USD 62 miliar, lebih tinggi dibanding bank terbesar di Jepang, peritel, dan lainnya, demikian dikutip detikINET dari Techspot, Selasa (23/6/2020).
Menurut para analis, terus melonjaknya valuasi Nintendo ini merefleksikan jumlah penjualan Switch yang terus meningkat, dan diperkirakan akan mencapai 75 juta unit pada akhir tahun finansial mereka, yaitu pada Maret 2021.
Saham Nintendo pun baru naik 2,8%, mencapai USD 467 per lembarnya. Ini adalah pertama kalinya saham mereka menyentuh angka tersebut sejak Nintendo merilis Wii pada 2008. Meningkatnya nilai saham ini juga diperkirakan terjadi karena Nintendo akan mengungkap lini game mereka untuk musim liburan 2020 ini.
Switch memang bukan konsol baru karena sudah dirilis sejak empat tahun lalu. Namun sejak pandemi Corona yang membuat sejumlah negara melakukan lockdown, penjualannya kembali meningkat. Bahkan harga Switch pun sampai melonjak karena stoknya yang terbatas.
David Gibson dari Astris Advisory Japan menyebut Nintendo mendapat keuntungan dari pandemi karena semakin banyak orang yang bermain game dan membeli game digital. Pasarnya akan sedikit menurun karena beberapa negara sudah mengendurkan lockdown-nya, namun itu juga menguntungkan bagi Nintendo karena artinya mereka bisa menggenjot produksi konsolnya tersebut.",23 Jun 2020 10:32,https://akcdn.detik.net.id/community/media/visual/2019/06/16/eac97f7c-fe8b-43d6-9237-fc08f888f069_169.jpeg?w=700&q=90
doc_00298,Detik-Inet,https://inet.detik.com/games-news/d-5065189/inikah-penampakan-bodi-ps5-yang-lebih-besar-dari-ps4,Inikah Penampakan Bodi PS5 yang Lebih Besar dari PS4?,"Foto yang menunjukkan ukuran bodi PlayStation 5 (PS5) baru-baru ini beredar di dunia maya, dan jika benar, maka PS5 bakal punya bodi yang lebih besar dariPS4.
Dalam foto yang dimaksud terlihat tiga orang dengan seragam Sony dan tampaknya sedang berada di sebuah pabrik. Satu dari tiga orang tersebut memegang sebuah perangkat berwarna putih yang mempunyai logo PS5 di bagian kiri atas, yang diduga adalah PS5.
Memang, dalam foto tersebut terlihat kalau perangkat yang diduga PS5 itu tampak berbeda dengan desain PS5 yang sudah dipamerkan oleh Sony. Namun hal ini kemungkinan terjadi karena sudut pemotretan yang tak menunjukkan bagian melengkung dari PS5 tersebut.
Foto ini beredar di forum ResetEra, dan menurut seorang pengguna di forum tersebut, foto itu asli dan tak dimanipulasi, demikian dikutip detikINET dari Digital Trends, Selasa (23/6/2020).
Sony belum mengeluarkan pernyataan mengenai keaslian foto ini. Namun dimensinya yang besar ini sejalan dengan pernyataan yang sebelumnya dikeluarkan oleh Matt MacLaurin, VP UX Design PlayStation.
Menurutnya PS5 memang harus dibuat dengan dimensi besar agar bisa mengatasi masalah pembuangan panas yang dihasilkan oleh konsol tersebut. Menurutnya, PS5 harus tak boleh mengulangi kesalahan Sony di PS4 dan PS4 Pro yang dikritisi karena kipasnya berisik.
""(Konsol) generasi ini adalah sebuah komputer super mini. Meski proses 7nm punya performa yang luar biasa dibandingkan dengan panas yang dihasilkan, daya yang dibutuhkan juga sangat ekstrim,"" ujar MacLaurin dalam sebuah tanya jawab di laman LinkedIn-nya.",23 Jun 2020 20:38,https://akcdn.detik.net.id/community/media/visual/2020/06/12/playstation-5-14_169.jpeg?w=700&q=90
doc_00299,Detik-Inet,https://inet.detik.com/games-news/d-5065516/microsoft-tutup-platform-streaming-game-mixer,Microsoft Tutup Platform Streaming Game Mixer,"Penutupan salah satu layanan dari perusahaan teknologi sebenarnya bukan hal aneh. Namun keputusanMicrosoftdalam menutupMixer, platform streaming game, terbilang mengejutkan.
Sebabnya Microsoft sebelumnya terlihat jor-joran dalam mempromosikan platform tersebut. Salah satunya dengan 'membajak' streamer game kelas kakap seperti Tyler 'Ninja' Blevins dan Michael 'Shroud' Grzesiek dari Twitch, platform streaming yang menjadi saingan Mixer.
Namun tampaknya Microsoft sudah tak sabar untuk mempunyai platform streaming game dengan komunitas besar dan disandingkan dengan rencana besar Microsoft untuk Xbox.
""Ternyata waktu yang dibutuhkan untuk mengembangkan komunitas live streaming sampai tahap tertentu tak sejalan dengan visi dan pengalaman pengguna yang mau dihadirkan oleh Microsoft dan Xbox untuk para gamer, jadi kami memutuskan untuk menyetop operasi Mixer dan membantu transisi komunitasnya ke platform baru,"" tulis Microsoft.
Platform baru yang dimaksud adalah Facebook Gaming. Ya, Microsoft bakal menggandengFacebookuntuk menggarap sektor streaming game ini, dan mereka memberikan opsi bagi para streamer di Mixer untuk pindah ke Facebook Gaming.
Sebagai contoh, Mixer Partner bakal otomatis mendapat status partner diFacebook Gaming, dan bisa mengikuti 'Facebook Gaming Level Up Program' yang ada di platform tersebut, demikian dikutip detikINET dari Techspot, Selasa (23/6/2020).
Tentu saja para streamer atau penyiar yang sebelumnya punya kontrak eksklusif dengan Microsoft tak lagi terikat dengan kontrak tersebut. Jadi Ninja ataupun Shroud bisa saja kembali ke Twitch atau platform lainnya.
Mixer bakal resmi ditutup pada 22 Juli mendatang, yang artinya para penyiar hanya punya waktu satu bulan untuk memutuskan apakah mereka akan pindah ke Facebook Gaming atau platform yang lain seperti Twitch.",24 Jun 2020 10:42,https://akcdn.detik.net.id/community/media/visual/2020/05/08/a6060080-fea6-468c-a7ed-f05ce22b1a0b_169.jpeg?w=700&q=90
doc_00300,Detik-Inet,https://inet.detik.com/games-news/d-5066277/poring-ranch-update-pertama-untuk-ragnarok-frontier,"Poring Ranch, Update Pertama untuk Ragnarok Frontier","Gravity Game Linkmemberikan update pertama untukRagnarok Frontier, dan pembaruan yang dirilis pada 18 Juni tersebut diberi nama Poring Ranch.
""Dengan adanya update ini, pemain Ragnarok Frontier akan lebih eksis dan lebih semangat lagi untuk berpetualang di dunia Midgard,"" ujar Harry Choi, President of Gravity Game Link dalam keterangan yang diterima detikINET.
Pada update kali ini, Ragnarok Frontier menambahkan fitur Mount. Mount adalah Pet atau hewan peliharaan yang dapat ditunggangi oleh karakter. Mount dapat meningkatkan kecepatan gerakan karakter dan dapat memberikan tambahan status, seperti ATK, Armor Break, Crit, Def dan HP, juga tambahan skill pasif.
Selain fitur Mount, terdapat juga fitur-fitur baru lain. Apa saja?",24 Jun 2020 15:07,https://akcdn.detik.net.id/community/media/visual/2020/06/23/ragnarok-frontier-2_169.jpeg?w=700&q=90
doc_00301,Detik-Inet,https://inet.detik.com/games-news/d-5066679/nintendo-bakal-berhenti-bikin-game-mobile,Nintendo Bakal Berhenti Bikin Game Mobile?,"Nintendomenjadi salah satu satu perusahaan game asal Jepang yang terbesar di dunia dengan menghadirkan banyak game dan konsol populernya seperti Nintendo Switch dan Switch Lite serta game populer yang sudah puluhan tahun tercipta seperti Super Mario dan Legend of Zelda.
Namun seperti dilansirdetikINETdariGizmochina, Nintendo dikabarkan berencana akan memberhentikan pembuatan game mobile.
""Kami tidak perlu mencari untuk terus merilis aplikasi game baru untuk pasar ponsel,"" ujar Presiden Nintendo Shuntaro Furukawa pada bulan Mei lalu.
Pernyataan ini tampaknya bukan hal yang menjadi kejutan besar karena perusahaan tidak melihat adanya peningkatan penjualan seperti yang dilakukan pesaingnya selama kondisi lockdown terkait pandemi COVID-19 pada bulan Februari hingga Mei.
Selama beberapa tahun terakhir, Nintendo telah merilis berbagai game mobile seperti Super Mario Run, Tur Mario Kart, dan Dr. Mario World. Sayangnya, tidak satu pun dari game-game tersebut yang mendapatkan kepopuleran besar dibandingkan dengan game mobile lainnya, seperti PUBG.
Diketahui Nintendo menggunakan sistem penetapan harga yang berbeda untuk gamenya yang mencakup langganan untuk Mario Kart Tour dan pembelian satu kali untuk Super Mario Run.
Hal Ini berbeda dari pendekatan yang digunakan game lain yang merupakan model freemium dengan peningkatan karakter dan senjata yang membutuhkan biaya.
Nintendo juga percaya bahwa game-gamenya dapat bekerja lebih baik dengan pengontrol yang dirancangnya daripada perangkat hanya layar sentuh.
Dilaporkan juga bahwaNintendoakan mengalihkan fokusnya ke game yang sudah dirilis dibanding merilis judul baru untuk sekarang.",24 Jun 2020 19:13,https://akcdn.detik.net.id/community/media/visual/2019/07/28/2254dd91-578c-4462-ad99-50ea67b20cd8_169.jpeg?w=700&q=90
doc_00302,Detik-Inet,https://inet.detik.com/games-news/d-5067263/the-last-of-us-2-yang-bikin-emosi-gamer-terombang-ambing,The Last of Us 2 yang Bikin Emosi Gamer Terombang-ambing,"Spoiler alert-- jika kamu belum bermain game ini atau tidak ingin mendapatkan bocoran, berhenti sampai di sini. Jangan dilanjurkan membaca.Setelah lima tahun berlalu dari game originalnya'The Last of Us', pemain kini bisa mengeksplorasi dunia pasca apokaliptik Amerika Serikat. Meski ditunggu-tunggu, beberapa pemain tidak menyukai ceritanya karena beberapa kejadian dalam game.Pemain sangat menyukai dua karakter utama permainan; Joel dan Ellie. Di paruh pertama pertandingan, Joel terbunuh oleh Abby. Hilangnya karakter favorit penggemar tentu saja membuat marah para penggemar.MengutipEssentially Sport, Abby adalah putri dari ahli bedah Firefly yang telah dibunuh Joel untuk menyelamatkan Ellie. Para pemain mengeluhkan narasi dan bagaimana kisah karakter kesayangan mereka.Para penggemar juga menyalahkan Naughty Dog karena membuat Joel begitu ceroboh dalam permainan. Padahal, karakternya di seri pertama digambarkan sebagai seseorang yang berhati-hati dan waspada.
[Gambas:Twitter]Tapi, tidak melulu komentar jelek, 'The Last of Us 2' mendapatkan banyak pujian secara gameplay dan visual. Visualnya benar-benar menunjukkan sebagai salah satu game terbaik yang pernah ada dan terlihat detail.Bahkan, banyak fans yang memuji tidak ada cela dari jalan cerita yang bisa mereka kritik karena kecintaan mereka dengan game tersebut.""Orang-orang perlu TENANG soal TLOU2 ... apakah kamu pikir itu akan menjadi 'Joel dan Ellie melawan dunia'? Aku menghabiskan sekitar 9-10 jam dan mencintai setiap detik,"" tulis @GhostofGriever diTwitter.""Aku bermain The Last of Us Part 2 sejauh ini. @Neil_Druckmann Anda telah membuat sebuah masterpiece,"" sahut @Scoby20 memuji Vice President Naughty Dog, Neil Druckmann.",25 Jun 2020 08:34,https://akcdn.detik.net.id/community/media/visual/2020/06/24/the-last-of-us-part-2_169.jpeg?w=700&q=90
doc_00303,Detik-Inet,https://inet.detik.com/games-news/d-5067907/pokemon-unite-game-moba-pokemon-perdana,"Pokemon Unite, Game MOBA Pokemon Perdana","Ada game baru yang menampilkan Pokemon. The Pokemon Company baru saja memperkenalkanPokemon Unite, game berjenis multiplayer online battle arena (MOBA) pertama yang melibatkan karakter Pokemon.
Game MOBA melibatkan pertarungan dua tim. Genre ini jadi populer berkat kesuksesan game semacam Dota 2 ataupun League of Legends.
Nah diPokemon Unite, dua tim yang masing-masing terdiri dari 5 gamer akan bertarung. Adapun platform yang bisa memainkannya adalah perangkat mobile dan konsol Nintendo Switch.
Game ini dibuat oleh Timi Studios yang merupakan anak perusahaan Tencent, yang sudah berpengalaman membuat Honor of Kings atau Arena of Valor. Pokemon Unite bisa dimainkan secara gratis pada awalnya.
DikutipdetikINETdari Venture Beat, Pokemon yang dimainkan beragam. Termasuk Pikachu, Clefable, Gengar, Snorlax, Lucario, Squirtle, Charmander, dan lainnya.
Saat level permainan naik, maka Pokemon yang dimainkan bisa memiliki kemampuan baru. Asyiknya lagi, permainan dapat dilakukan lintas platform antara Switch, ponsel Android ataupun perangkat iOS.
Sayang, belum disebutkan informasi kapanPokemon Unitediluncurkan resmi. Kemungkinan masih beberapa bulan lagi.",25 Jun 2020 16:54,https://akcdn.detik.net.id/community/media/visual/2020/06/25/pokemon-unite.png?w=700&q=90
