id_dokumen,sumber,url,judul,konten,tanggal_terbit,url_thumbnail
doc_00001,Detik-Inet,https://inet.detik.com/games-news/d-4844474/cobain-nih-game-terbaru-2020-ragnarok-tactics,"Cobain Nih Game Terbaru 2020, Ragnarok Tactics",N/A,02 Jan 2020 20:55,https://akcdn.detik.net.id/community/media/visual/2020/01/02/cb26ff8f-f556-4e5f-9ace-68df54306923.png?w=700&q=90
doc_00002,Detik-Inet,https://inet.detik.com/games-news/d-4845760/pendapatan-turun-25-fortnite-tetap-jadi-game-teratas-di-2019,"Pendapatan Turun 25%, Fortnite Tetap Jadi Game Teratas di 2019",N/A,03 Jan 2020 21:12,https://akcdn.detik.net.id/community/media/visual/2019/04/25/6777cb75-99b7-4de9-a149-c8c7be26f05d_43.jpeg?w=700&q=90
doc_00003,Detik-Inet,https://inet.detik.com/games-news/d-4846739/switch-lampaui-penjualan-super-nintendo,Switch Lampaui Penjualan Super Nintendo,N/A,04 Jan 2020 21:27,https://akcdn.detik.net.id/community/media/visual/2018/10/04/19de9f08-9ecc-457a-a791-08eb93a66080.jpeg?w=700&q=90
doc_00004,Detik-Inet,https://inet.detik.com/games-news/d-4847367/game-terbaru-yang-akan-rilis-bulan-januari-2020,Game Terbaru yang Akan Rilis Bulan Januari 2020,N/A,05 Jan 2020 18:44,https://akcdn.detik.net.id/community/media/visual/2020/01/04/c1f93e81-f17d-4fbb-8695-254724cfcef6.jpeg?w=700&q=90
doc_00005,Detik-Inet,https://inet.detik.com/games-news/d-4850135/wishnutama-presiden-tahu-esport-masa-depan-yang-harus-dibangun,Wishnutama: Presiden Tahu eSport Masa Depan yang Harus Dibangun,N/A,07 Jan 2020 17:43,https://akcdn.detik.net.id/community/media/visual/2020/01/07/6949ba2b-5ff9-4e32-8dac-08975aa1e305_169.jpeg?w=700&q=90
doc_00006,Detik-Inet,https://inet.detik.com/games-news/d-4850168/giring-indonesia-siap-jadi-mercusuar-esport-asia-tenggara,Giring: Indonesia Siap Jadi Mercusuar eSport Asia Tenggara!,N/A,07 Jan 2020 18:02,https://akcdn.detik.net.id/community/media/visual/2020/01/07/f3019541-800e-4b27-b846-3005fc3089f5_169.jpeg?w=700&q=90
doc_00007,Detik-Inet,https://inet.detik.com/games-news/d-4850253/sony-akhirnya-rilis-logo-ps5,Sony Akhirnya Rilis (Logo) PS5,N/A,07 Jan 2020 19:15,https://akcdn.detik.net.id/community/media/visual/2020/01/07/e635bb94-8ce9-40c7-92c3-2ea85924d825_169.jpeg?w=700&q=90
doc_00008,Detik-Inet,https://inet.detik.com/games-news/d-4850270/ariel-noah-bikin-tim-esport-the-pillars,Ariel Noah Bikin Tim eSport The Pillars,N/A,07 Jan 2020 21:33,https://akcdn.detik.net.id/community/media/visual/2019/12/14/36862116-2e62-4c75-916e-c879a17a5c82_169.png?w=700&q=90
doc_00009,Detik-Inet,https://inet.detik.com/games-news/d-4853607/update-pubg-mobile-0-16-5-bawa-segudang-fitur-baru,Update PUBG Mobile 0.16.5 Bawa Segudang Fitur Baru,N/A,10 Jan 2020 09:00,https://akcdn.detik.net.id/community/media/visual/2020/01/10/f630d817-4f96-4e46-8347-8ab641f0bc57_169.jpeg?w=700&q=90
doc_00010,Detik-Inet,https://inet.detik.com/games-news/d-4855181/mantuls-3-game-indonesia-jadi-finalis-taipei-game-show-2020,Mantuls! 3 Game Indonesia Jadi Finalis Taipei Game Show 2020,N/A,11 Jan 2020 13:37,https://akcdn.detik.net.id/community/media/visual/2020/01/11/22f474c8-5373-47d3-b9a6-ead47d2133c6_169.mpo?w=700&q=90
doc_00011,Detik-Inet,https://inet.detik.com/games-news/d-4855278/10-negara-paling-bawel-ngomongin-game-indonesia-termasuk,"10 Negara Paling Bawel Ngomongin Game, Indonesia Termasuk",N/A,11 Jan 2020 18:11,https://akcdn.detik.net.id/community/media/visual/2019/08/29/59bccb00-84cc-43f6-80fa-8ebae85c9433.jpeg?w=700&q=90
doc_00012,Detik-Inet,https://inet.detik.com/games-news/d-4857267/10-tim-esport-indonesia-timur-lolos-ke-final-piala-presiden,10 Tim eSport Indonesia Timur Lolos ke Final Piala Presiden,N/A,13 Jan 2020 15:52,https://akcdn.detik.net.id/community/media/visual/2020/01/13/f51c6d38-d61a-4ded-b38a-76edefb9a013_169.jpeg?w=700&q=90
doc_00013,Detik-Inet,https://inet.detik.com/games-news/d-4857655/rumor-the-sims-5-bakal-rilis-kapan,"Rumor The Sims 5 Bakal Rilis, Kapan?",N/A,13 Jan 2020 21:18,https://akcdn.detik.net.id/community/media/visual/2018/10/10/3209196a-ef0b-4a9a-a8f0-c7e854f2634c_169.png?w=700&q=90
doc_00014,Detik-Inet,https://inet.detik.com/games-news/d-4858757/garena-gelar-turnamen-fire-free-total-hadiah-rp-1-2-miliar,"Garena Gelar Turnamen Fire Free, Total Hadiah Rp 1,2 Miliar",N/A,14 Jan 2020 16:40,https://akcdn.detik.net.id/community/media/visual/2020/01/14/a33272bd-81ca-4f25-b023-640e34cf6374_169.jpeg?w=700&q=90
doc_00015,Detik-Inet,https://inet.detik.com/games-news/d-4858943/ariel-noah-bentuk-tim-esport-dari-dulu-suka-main-ragnarok,Ariel Noah Bentuk Tim eSport: Dari Dulu Suka Main Ragnarok,N/A,14 Jan 2020 22:37,https://akcdn.detik.net.id/community/media/visual/2020/01/14/23bd2686-9c0b-4771-863c-ad1acb034cd7.jpeg?w=700&q=90
doc_00016,Detik-Inet,https://inet.detik.com/games-news/d-4859926/sony-absen-lagi-di-pameran-game-terbesar-dunia-apa-alasannya,"Sony Absen Lagi di Pameran Game Terbesar Dunia, Apa Alasannya?","""Setelah evaluasi menyeluruh, Sony memutuskan untuk tidak berpartisipasi di E3 2020. Kami menghormati ESA sebagai organisasi, tapi kami merasa visi E3 2020 bukan merupakan venue yang tepat untuk apa yang kita fokuskan di tahun ini,"" kata juru bicara Sony dikutipdetikINETdari CNET, Rabu (15/1/2020).""Kita memiliki deretan judul game yang akan hadir untuk PlayStation 4, dan dengan peluncuranPlayStation 5yang akan datang, kami benar-benar menantikan tahun penuh perayaan dengan penggemar kami,"" imbuhnya.Juru bicaraSonyjuga menambahkan bahwa perusahaannya akan lebih fokus kepada penggemar melalui strategi event global. Mereka juga sedang merencanakan ratusan event konsumen yang akan digelar di seluruh dunia.Pengumuman Sony ini cukup mengejutkan karena Sony telah merencanakan peluncuran PlayStation 5 (PS5) sebelum akhir tahun 2020. Apalagi E3 sering menjadi arena bagi raksasa gaming seperti Microsoft dan Nintendo untuk memamerkan konsol terbaru mereka.
Menyusul kabar absennyaSony, ESA sebagai penyelenggara juga merilis keterangan yang menjanjikan E3 2020 tetap akan menjadi event yang menghibur.""E3 2020 akan menjadi pertunjukan yang menarik, berenergi tinggi yang menampilkan pengalaman, mitra, area pameran dan program baru yang akan menghibur pengunjung baru maupun lama,"" kata ESA dalam keterangan resminya.Sony sendiri baru-baru ini memamerkan logo untuk PS5 lewat konferensi pers di ajang CES 2020. Tapi logo tersebut terlihat sangat mirip dengan logo PS4, dengan perbedaan hanya di angka '5'.",15 Jan 2020 14:26,https://akcdn.detik.net.id/community/media/visual/2019/09/01/ce39e04c-e71d-40c9-a604-a25e3939560c_43.jpeg?w=700&q=90
doc_00017,Detik-Inet,https://inet.detik.com/games-news/d-4860234/trailer-resident-evil-3-remake-meluncur-nemesis-lebih-garang,"Trailer Resident Evil 3 Remake Meluncur, Nemesis Lebih Garang",[Gambas:Youtube],15 Jan 2020 17:12,https://akcdn.detik.net.id/community/media/visual/2020/01/15/6c97b1e2-461c-4d90-82cd-0cff745a0d9b_169.png?w=700&q=90
doc_00018,Detik-Inet,https://inet.detik.com/games-news/d-4861548/xbox-baru-bakal-bisa-mainkan-game-pc,Xbox Baru Bakal Bisa Mainkan Game PC?,N/A,16 Jan 2020 14:44,https://akcdn.detik.net.id/community/media/visual/2019/12/13/de284c3b-076f-4bb5-b921-7cb2402b190f_169.jpeg?w=700&q=90
doc_00019,Detik-Inet,https://inet.detik.com/games-news/d-4863908/menerawang-tren-industri-esport-indonesia-di-2020,Menerawang Tren Industri eSport Indonesia di 2020,N/A,18 Jan 2020 09:02,https://akcdn.detik.net.id/community/media/visual/2020/01/17/bf6d5a09-4898-4201-9197-a02a9b994430.png?w=700&q=90
doc_00020,Detik-Inet,https://inet.detik.com/games-news/d-4864286/pb-esports-indonesia-dilantik-jadi-wadah-esport-nasional,"PB Esports Indonesia Dilantik, Jadi Wadah eSport Nasional",N/A,18 Jan 2020 14:30,https://akcdn.detik.net.id/community/media/visual/2020/01/18/b07319bd-9a3e-423d-b9d9-efd8048284ac_169.jpeg?w=700&q=90
doc_00021,Detik-Inet,https://inet.detik.com/games-news/d-4864382/lima-tugas-utama-pb-esports-indonesia-setelah-dilantik,Lima Tugas Utama PB Esports Indonesia Setelah Dilantik,N/A,18 Jan 2020 16:30,https://akcdn.detik.net.id/community/media/visual/2020/01/18/9203e6d3-7c35-40f3-b56b-ff150ba05d9f_43.jpeg?w=700&q=90
doc_00022,Detik-Inet,https://inet.detik.com/games-news/d-4864436/igl-season-2-dimulai-tandingkan-fifa-dan-pes-2020,"IGL Season 2 Dimulai, Tandingkan FIFA dan PES 2020",N/A,18 Jan 2020 17:27,https://akcdn.detik.net.id/community/media/visual/2020/01/18/fdca209a-834a-49fc-af34-0fa619ded84d_169.jpeg?w=700&q=90
doc_00023,Detik-Inet,https://inet.detik.com/games-news/d-4864524/final-predator-league-2020-digelar-hadiah-rp-200-juta,"Final Predator League 2020 Digelar, Hadiah Rp 200 Juta",N/A,18 Jan 2020 18:03,https://akcdn.detik.net.id/community/media/visual/2020/01/18/809b98ca-e7b2-4523-9748-9d8c85025a0d_169.jpeg?w=700&q=90
doc_00024,Detik-Inet,https://inet.detik.com/games-news/d-4864596/pb-esi-sudah-dilantik-siapa-yang-urus-timnas-esport,"PB ESI Sudah Dilantik, Siapa yang Urus Timnas eSport?",N/A,18 Jan 2020 19:31,https://akcdn.detik.net.id/community/media/visual/2020/01/18/b07319bd-9a3e-423d-b9d9-efd8048284ac_43.jpeg?w=700&q=90
doc_00025,Detik-Inet,https://inet.detik.com/games-news/d-4864999/google-stadia-janjikan-120-game-baru-di-2020,Google Stadia Janjikan 120 Game Baru di 2020,N/A,19 Jan 2020 12:07,https://akcdn.detik.net.id/community/media/visual/2019/03/30/0643f76a-3c3c-4973-9fd5-12e072abb607_43.jpeg?w=700&q=90
doc_00026,Detik-Inet,https://inet.detik.com/games-news/d-4865040/dor-dor-keseruan-di-update-terbaru-call-of-duty-mobile,Dor-dor! Keseruan di Update Terbaru Call of Duty: Mobile,N/A,19 Jan 2020 13:09,https://akcdn.detik.net.id/community/media/visual/2020/01/19/aabcc2a4-db21-417d-a4bf-0e4d2efa8e79_169.jpeg?w=700&q=90
doc_00027,Detik-Inet,https://inet.detik.com/games-news/d-4865296/genjot-esport-indonesia-kecepatan-internet-perlu-ditingkatkan,"Genjot eSport Indonesia, Kecepatan Internet Perlu Ditingkatkan",N/A,19 Jan 2020 18:01,https://akcdn.detik.net.id/community/media/visual/2020/01/19/0839730a-8d8b-4be1-a053-10d1d907ff1c_169.jpeg?w=700&q=90
doc_00028,Detik-Inet,https://inet.detik.com/games-news/d-4865796/cyberpunk-2077-molor-dirilis-alasannya-biar-makin-tokcer,"Cyberpunk 2077 Molor Dirilis, Alasannya Biar Makin Tokcer",N/A,20 Jan 2020 11:09,https://akcdn.detik.net.id/community/media/visual/2019/06/10/5cd18154-f706-4e45-86ef-aaf77e5257d0_43.png?w=700&q=90
doc_00029,Detik-Inet,https://inet.detik.com/games-news/d-4867208/tencent-games-dan-black-shark-kolaborasi-bikin-ponsel-gaming,Tencent Games dan Black Shark Kolaborasi Bikin Ponsel Gaming,N/A,21 Jan 2020 11:18,https://akcdn.detik.net.id/community/media/visual/2019/07/31/51748b5e-5bae-4d21-869e-6af23aaa005d.jpeg?w=700&q=90
doc_00030,Detik-Inet,https://inet.detik.com/games-news/d-4868093/sony-usung-slogan-baru-untuk-ps5,Sony Usung Slogan Baru untuk PS5?,N/A,21 Jan 2020 21:45,https://akcdn.detik.net.id/community/media/visual/2020/01/07/e635bb94-8ce9-40c7-92c3-2ea85924d825_169.jpeg?w=700&q=90
doc_00031,Detik-Inet,https://inet.detik.com/games-news/d-4870665/mengagetkan-peluncuran-playstation-5-diklaim-sebentar-lagi,"Mengagetkan, Peluncuran PlayStation 5 Diklaim Sebentar Lagi","Tahun ini,PlayStation 5bakal diluncurkanSony. Waktunya tak dibeberkan, kabarnya jelang akhir tahun. Tapi menurut developer game yang satu ini, PS5 bakal menampakkan diri sebentar lagi.
Adalah David Scott Jaffe yang turut mengembangkan game populer God of War, mengumbar klaim tersebut. Ia mengklaim, Sony bakal memamerkan PlayStation 5 sebulan lagi.
""Pengungkapan PS5 kurang dari 4 minggu,"" tulisnya di Twitter. Berarti kemungkinan, pada bulan Februari kita sudah dapat menyaksikan seperti apa sebenarnya PS5.
Kenapa Sony tampak terburu-buru? Menurut David, mereka tak ingin Xbox anyar dari Microsoft lebih banyak dibicarakan.
""Sony tahu gamer hard core mengais tiap info dan bahwa meski Microsoft mendominasi obrolan saat ini, dengan mudah itu bisa berubah saat mereka siap mengungkap PS5, jika memang bagus,"" jelasnya.
Ia mengingatkan, PlayStation 4 pun diungkap Sony pada bulan Februari tahun 2013. Kemudian dipasarkan pada bulan November.
Ya, dikeluarkan barangnya tidak berarti langsung dijual. Sesuai prediksi, kemungkinan PlayStation 5 kalaupun benar meluncur bulan depan, baru akan dijual jelang akhir tahun 2020 ini.",23 Jan 2020 16:52,https://akcdn.detik.net.id/community/media/visual/2019/12/02/b5ad93b8-d3db-4ba0-86be-b636f731eefe_169.jpeg?w=700&q=90
doc_00032,Detik-Inet,https://inet.detik.com/games-news/d-4871012/selamat-tinggal-ea-matikan-tetris-mobile,"Selamat Tinggal, EA Matikan Tetris Mobile",N/A,23 Jan 2020 22:11,https://akcdn.detik.net.id/community/media/visual/2020/01/23/5d2aebf0-b1e9-429d-bd4d-ddde419b64ee.png?w=700&q=90
doc_00033,Detik-Inet,https://inet.detik.com/games-news/d-4871817/ramai-virus-corona-game-wabah-penyakit-mematikan-jadi-tren-di-china,"Ramai Virus Corona, Game Wabah Penyakit Mematikan Jadi Tren di China","Game berbau 'kiamat' dan wabah penyakit kini viral di China seiring dengan merebaknyaVirus Coronadi Negara Tirai Bambu tersebut.
Berdasarkan informasi terbaru pada Kamis (23/1) waktu setempat, korban tewas akibatVirus Coronadi wilayah China bertambah menjadi 25 orang dan menangani sedikitnya 830 kasus pasien terinfeksi.
Plague Inc. dan Rebel Inc., keduanya dikembangkan oleh studio game Inggris Ndemic Creations, telah mengalami peningkatan jumlah pengunduhan sejak Senin (20/1), yang mana merupakan hari China mengumumkan bahwa penyakit mirippneumoniaini telah menyebar ke kota-kota di luar Wuhan, Kota di China di mana wabah dimulai.
Plague Inc, yang memungkinkan pemain mengembangkan patogen (organisme hidup yang menyebabkan penyakit) untuk memusnahkan umat manusia, melonjak dari posisi kelima ke peringkat teratas di antara game berbayar di store iOS China pada Rabu (22/1), menurut penyedia data Sensor Tower.
Sementara itu, Rebel Inc. merupakan simulasi strategi politik atau militer yang unik juga naik posisi. Pada game ini, pemain ditantang untuk menangani pemberontakan guna menstabilkan negara yang dilanda perang.
Beberapa waktu terakhir, pihak otoritas kesehatan China mengkonfirmasi adanya virus baru penyebab penyakit tersebut yang dinamakan Virus Corona ataucoronavirus. Virus ini masih satu famili dengan MERS-CoV (Middle East Respiratory Syndrome-Corona Virus) dan SARS (Severe Acute Respiratory Syndrome). Untuk Virus Corona baru ini dinamai 2019-nCoV (novel coronavirus).",24 Jan 2020 13:37,https://akcdn.detik.net.id/community/media/visual/2020/01/23/9487848e-d1af-4293-813f-09c4150464d4_169.jpeg?w=700&q=90
doc_00034,Detik-Inet,https://inet.detik.com/games-news/d-4873645/plague-inc-game-yang-mendadak-populer-gara-gara-virus-corona,"Plague Inc, Game yang Mendadak Populer Gara-gara Virus Corona","Wabahvirus coronaberdampak pada penjualangameberjudul Plague Inc yang mendadak meroket. Kok bisa?
Plague Inc menjadi aplikasi paling laris di App Store China pada Rabu lalu, padahal game ini sudah ada sejak delapan tahun yang lalu. Tampaknya banyak orang yang mengunduh game ini untuk mencari cara menghadapivirusmematikan yang misterius ini.
""Setiap kali ada wabah penyakit baru, kami melihat adanya peningkatan jumlah pemain, karena banyak orang mencari cara untuk mempelajari bagaimana wabah itu bisa menyebar dan untuk memahami kompleksitas penyebaran virus,"" tulis Ndemic Creations, pembuat game tersebut, dalam keterangannya, dikutip dari Cnet, Minggu (26/1/2020).
Plague Incadalah game yang tersedia untuk bermacam platform, baik itu Android, iOS, Steam, maupun konsol. Ndemic Creation, developer asal Inggris, merilis game ini pada 2012 lalu.
Di game bergenre real time strategy ini, pemainnya ditugaskan untuk menyebarkan patogen berbahaya termasuk mengatur strategi untuk cara penyebarannya. Pemainnya pun harus mengatur strategi untuk menghadapi langkah dari pemerintah dan peneliti yang mau melawan ancaman global tersebut.
Virus Corona, atau coronavirus, adalah virus baru yang masih satu famili dengan MERS-CoV (Middle East Respiratory Syndrome-Corona Virus) dan SARS (Severe Acute Respiratory Syndrome). Untuk Virus Corona baru ini dinamai 2019-nCoV (novel coronavirus).",26 Jan 2020 14:30,https://akcdn.detik.net.id/community/media/visual/2020/01/25/45cf5d07-f058-4642-8a28-3b133f054023_169.jpeg?w=700&q=90
doc_00035,Detik-Inet,https://inet.detik.com/games-news/d-4873976/sony-siapkan-pesta-istimewa-sambut-kedatangan-ps5,Sony Siapkan Pesta Istimewa Sambut Kedatangan PS5,"Sonydiperkirakan akan menyingkap selubung PlayStation 5 (PS5) bulan depan. Bocoran yang beredar menyebutkan, akan ada konferensi pers besar-besaran pada 5 Februari di New York, Amerika Serikat.
Sejauh ini, Sony belum mengonfirmasi rumor tersebut. Sony sendiri memang belum mengirimkan undangan resmi kepada media terkait dengan acara tersebut. Laporan terbaru menyebutkan, Sony merencanakan pengumuman hardware yang akan mengejutkan pada peluncuran PS5.
Dikutip dariArs Technica, selain bocoran tentang PS5 dan hardware istimewa yang masih dirahasiakan, muncul pula kabar yang menyebutkan headset PlayStation VR 2 akan dirilis berbarengan dengan event ini.
""Di 2020, Sony akan merilis PlayStation 5 dan versi terbaru PlayStation VR yang akan memperluas jangkauan penggunanya ke basis pengguna VR high end,"" tulis sumber lain terkait hal ini,TechBriefly.
Selama beberapa bulan terakhir, bocoran mengenai PS5 sudah santer bermunculan. Bocoran tersebut antara lain dukungan terhadap grafis 8K, ray tracing, storage SSD super kencang, dan kompabilitas terhadap game PS4.
Konsol tersebut disebut akan menggunakan CPU 8 core milik AMD yang berbasis pada arsitektur Zen 2 serta GPU AMD Radeon berbasis arsitektur Navi. Bocoran mengenai bentuk PS5 memang masih belum meyakinkan sampai saat ini. Namun setidaknya, kontrolernya terlihat mempunyai bentuk yang tak jauh berbeda dibanding kontroler PS4, namun dengan sejumlah teknologi baru, seperti haptic feedback dan adaptive trigger.",26 Jan 2020 19:31,https://akcdn.detik.net.id/community/media/visual/2020/01/07/e635bb94-8ce9-40c7-92c3-2ea85924d825.jpeg?w=700&q=90
doc_00036,Detik-Inet,https://inet.detik.com/games-news/d-4875176/giring-ungkap-alasan-free-fire-jadi-game-piala-presiden,Giring Ungkap Alasan Free Fire Jadi Game Piala Presiden,"Free Firemenjadi salah satu game yang dipertandingkan diPiala Presiden2020. Ada sejumlah alasan kenapa permainan besutan Garena ini dipilih.
Ketua Pelaksana Piala PresideneSport2020 Giring Ganesha Djumaryo mengungkap kalau Garena punya komitmen agar game Free Fire bisa diterima oleh semua pihak. Salah satunya dari segi visual, game ini dibuat ramah anak-anak.
""Kita meminta ada beberapa dihilangkan saat Piala Presiden, mereka mengiyakan. Misalnya darah, nanti di finalnya akan dihilangkan. Misalkan ada yang kalah gambarnya tengkorak, nanti diganti helm,"" terang Giring saat acara pengumuman kolaborasi Samsung dengan Piala Presiden 2020 di Jakarta, Senin (27/1/2020).
Garena pun dinilai punya komitmen kuat dalam membesarkan Free Fire di Indonesia. Salah satu wujudnya mereka rajin membuat kompetisi anak sekolah. Menariknya Garena mensyaratkan gamer yang ikut kompetisi wajib bagus.
""Nilainya harus 70 ke atas, dan kalau nilainya tidak bagus tidak boleh ikutan,"" ungkap Giring.
Dari itu semua, mantan vokalis band Nidji ini kemudian berkesimpulan kalau itikad baik Free Fire dan Garena cukup besar. Mereka memasukkan banyak aspek yang membuat gamenya tidak sekadar asyik dimainkan.
""Garena membuat Free Fire aman untuk dimainkan dan memberikan peluang karier menjanjikan bagi para gamer ke depannya,"" pungkas Giring.
Untuk diketahui, Piala Presiden Esport telah memasuki tahun kedua. Babak final akan dilaksanakan pada tanggal 1 dan 2 Februari mendatang di ICE BSD, Tangerang. Bila tahun lalu hanya bisa menjaring 15 ribu pemain, kini 157.661 pemain sudah mendaftar dan ikut kualifikasi.
Nantinya akan ada 4 game yang dikompetisikan salah satunya adalah Free Fire dengan 12 tim yang akan dipertandingkan. Selain itu ada game lokal yang terpilih dan akan diumumkan.",27 Jan 2020 17:43,https://akcdn.detik.net.id/community/media/visual/2019/06/27/95b29c0b-396a-493b-bb93-1d0df221608d.jpeg?w=700&q=90
doc_00037,Detik-Inet,https://inet.detik.com/games-news/d-4875390/kompetisi-league-of-legends-di-china-ditunda-karena-virus-corona,Kompetisi League of Legends di China Ditunda karena Virus Corona,"KompetisiLeague of Legends (LoL)teratas di China terpaksa ditunda karena wabah virus corona yang terus meluas. Belum ada kepastian kapan turnameneSportini akan kembali dilanjutkan.
DilansirdetikINETdari Forbes, Senin (27/1/2020) kompetisi League of LoL Pro League (LPL) seharusnya memulai minggu keduanya pada 5 Februari mendatang, setelah selesainya libur Imlek.
Turnamen ini dijadwalkan memainkan dua pertandingan setiap harinya selama satu minggu. Tapi, LPL mengumumkan bahwa tidak akan ada pertandingan yang dimainkan di minggu kedua, dan kompetisi ditunda hingga jadwal yang belum ditentukan.
Lewat akun Twitter resminya,LPLpun meminta maaf atas penundaan minggu kedua kompetisi ini.
""Kami memutuskan untuk menunda minggu kedua LPL sampai kami bisa memastikan kesehatan dan keselamatan pemain dan penggemar kami,"" tulis LPL dalam cuitannya.
""Kepada penggemar kami, kami dengan tulus meminta maaf karena hal ini sampai terjadi dan kami akan membagikan informasi apapun secepatnya. Jaga keselamatan dan terima kasih atas dukungan kalian,"" sambungnya.
Tidak diketahui apakah minggu-minggu kompetisi ke depannya akan terdampak dengan penundaan juga. Tapi jika virus corona masih belum bisa ditangani, sepertinya akan ada penundaan kompetisi lebih lanjut.
Penundaan tidak hanya dialami oleh LPL. Kompetisi divisi keduaLoLDevelopment League (LDL) yang seharusnya digelar untuk pertama kalinya bersamaan dengan minggu kedua LPL juga harus ditunda sampai waktu yang belum ditentukan.
Otoritas China lewat General Administration of Sport telah mengimbau seluruh penyelenggara kompetisi olahraga untuk sementara menghentikan kegiatan hingga bulan April mendatang karena wabah virus corona.
Minggu pertama kompetisi LPL sendiri telah dimulai awal Januari 2020 dan diikuti oleh tim-tim terbaik di China. Sayangnya, FunPlus Phoenix yang menjadi juara dunia LoL tahun 2019 telah menelan dua kekalahan di minggu pertama.",27 Jan 2020 19:50,https://akcdn.detik.net.id/community/media/visual/2019/11/12/70629a30-367e-401d-ac03-d673ebdff2da_43.jpeg?w=700&q=90
doc_00038,Detik-Inet,https://inet.detik.com/games-news/d-4875462/antara-jokowi-esport-dan-piala-presiden,"Antara Jokowi, eSport dan Piala Presiden","Jokowi tampaknya begitu jatuh hati denganeSport. Sampai-sampai dirinya minta dibuatkan turnamen eSport tingkat nasional.
Demikian diungkap Presiden Indonesia eSports Premier League (IEPL) Giring Ganesha Djumaryo saat menceritakan asal muasal digelarnya Piala Presiden.
Keinginan Jokowi itu kemudian diutarakan ke Kepala Badan Ekonomi Kreatif (Bekraf) yang kala itu masih dijabat Triawan Munaf. Triawan kemudian meminta IESPL menghelat pertandingan eSport tingkat nasional.
Maka, diselenggarakan Piala Presiden eSports pada Mei 2019. Hanya satu game yang dipertandingkan, yakni Mobile Legends waktu itu. Tercatat ada 18 ribu gamer yang mengikuti kualifikasi. Namun, hanya 16 tim eSport yang bersaing menjadi terbaik di putaran final.
""Begitu sukses saya lapor ke Bekraf, Kepala Staf Presiden (KSP), Kominfo dan Kemenpora. Pak Muldoko malah meminta agar IESPL menggelar kembali Piala Presiden eSports,"" ujar Giring.
Muldoko, kata Giring, ingin turnamen tersebut digelar sebelum pelantikan Presiden dan Wakil Presiden. Tujuannya agar turnamen tersebut jadi alat pemersatu bangsa setelah Pemilihan Presiden dan Wakil Presiden digelar.
Hanya saja, keinginan itu belum bisa diwujudkan. Sebabnya tidak memungkinkan untuk menggelar turnamen skala besar dalam jarak waktu berdekatan. Tapi, bukan berarti Piala Presiden tamat riwayatnya. Pemerintah kembali menggelar turnamen eSport di 2020 ini.
Giring ditunjuk sebagai ketua pelaksananya. Piala Presiden eSport pun dibuat lebih besar, skalanya tidak hanya nasional tapi mencakup Asia Tenggara.
""Akan ada atlet eSport dari Thailand, Vietnam, Filipina, Kamboja, Singapura dan Malaysia,"" kata mantan vokalis band Nidji ini.
Jumlah game yang dipertandingkan pun bertambah. Ada Free Fire, PES 2020, Fruit Dart dan game lokal yang akan segera diumumkan.
Tak disangka, antusiasme Piala Presiden 2020 lebih tinggi. Jumlah peserta meningkat drastis, catatan IESPL ada 177 ribu atlet eSports yang mengikuti klasifikasi.
""Ini meningkat 10 kali lipat dari penyelenggaraan tahun lalu,"" klaim Giring.
Kendati Piala Presiden eSports terus meningkat, Giring berharap pemerintah terus berinvestasi di pengembangan eSport dan industri game Tanah Air. Sebab, dia yakin ke depan potensinya bertambah besar.
""Bila terus berinvestasi, eSport dan game lokal akan mendunia. Ini akan memberikan devisa baru untuk Indonesia,"" pungkas Giring.",27 Jan 2020 18:59,https://akcdn.detik.net.id/community/media/visual/2019/12/06/3e1b14b0-6fdd-4a40-b042-9a9b1c2d0149_169.jpeg?w=700&q=90
