id_dokumen,sumber,url,judul,konten,tanggal_terbit,url_thumbnail
doc_00206,Detik-Inet,https://inet.detik.com/games-news/d-5004785/telkomsel-gelar-turnamen-esport-online-berhadiah-rp-1-6-miliar,"Telkomsel Gelar Turnamen eSport Online Berhadiah Rp 1,6 Miliar","Indonesia Games Champonship(IGC) kembali digelar. Turnamenesportgarapan Dunia Games Telkomsel ini siap membagikan hadiah senilai Rp 1,6 miliar.
MenggandengGarena, IGC 2020 akan diselenggarakan mulai Mei hingga September. Babak kualifikasi awal IGC 2020 akan berlangsung secara online.
""IGC 2020 agar berlangsung secara online, sehingga peserta dapat berkontribusi memajukan industri eSport di Indonesia dengan tetap menjaga jarak aman. Ini juga menjadi bentuk dukungan kami kepada pemerintah yang terus mengimbau masyarakat agar tidak menciptakan kerumunan dan menjalankan upaya physical distancing,"" terang Rachel Goh, Direktur Marketing Telkomsel dalam keterangan resminya.
IGC 2020 terbuka untuk semua. Ada dua genre permainan yang akan dipertandingkan, meliputi Multiplayer Online Battle Arena (MOBA) dan Battleground Survival, baik itu PC game maupun mobile game. Judul permainan yang akan dipertandingkan pada kategori PC game adalah League of Legends. Sedangkan kategori mobile game mencakupFree Fire,Call of Duty Mobile, danArena of Valor.
Seluruh penggemar game di seluruh Indonesia sudah dapat mendaftarkan timnya ke IGC 2020 mulai tanggal 6 Mei 2020 hingga Juni mendatang dengan mengaksesigc.duniagames.co.id. Selanjutnya, para peserta akan mengikuti rangkaian babak kualifikasi yang berlangsung pada Juli dan Agustus, bertepatan dengan libur tahun ajaran sekolah sehingga tidak mengganggu kegiatan belajar para pelajar di rumah saat ini.
Kemudian, delapan tim terbaik dari masing-masing game yang dilombakan (khusus Free Fire 12 tim), akan mengikuti babak Grand Final yang akan diselenggarakan pada September 2020.
Rangkaian pertandingan IGC 2020 juga dapat disaksikan melalui berbagai channel digital yang dikelola oleh Dunia Games, meliputi website hingga media sosial seperti YouTube. Selain itu, Telkomsel juga telah menyiapkan platform aplikasi layanan video on demand MAXstream sebagai pilihan bagi penggila eSport di seluruh Indonesia untuk mengikuti jalannya kompetisi IGC 2020.
""Kami berharap, IGC 2020 dapat memenuhi kebutuhan akan hiburan bagi para pecinta game di seluruh Indonesia di tengah masa sulit menghadapi pandemi COVID-19 seperti saat ini. IGC 2020 ditujukan tidak hanya bagi para pemain profesional, namun juga untuk yang gemar mengikuti perkembangan eSport secara umum, untuk menguatkan ekosistem eSport di Tanah Air secara menyeluruh,"" kata Rachel.
Sebelumnya, Telkomsel melalui Dunia Games telah menyelenggarakan IGC pada 2017 dan 2018. Di dua edisi tersebut, total terdapat lebih dari 22.000 peserta dari seluruh penjuru negeri yang mengikuti turnamen ini. Selain itu, jutaan penonton di berbagai channel digital milik Dunia Games secara antusias mengikuti perkembangan dari IGC 2017 dan 2018.
Animo yang ditunjukkan para pecinta mobile games di seluruh Indonesia terhadap IGC membuat Telkomsel menggelar kembali kompetisi tersebut dan diharapkan dapat menjangkau lebih banyak elemen masyarakat untuk lebih mengenal ekosistem eSport di Tanah Air.
""Kami akan terus mempertimbangkan kemungkinan gelaran IGC dapat terus berlangsung di tahun mendatang secara berkala, sehingga memberikan dampak yang lebih besar dalam memajukan serta menguatkan industrieSportdi Indonesia,"" tutup Rachel.",06 Mei  2020 21:35,https://akcdn.detik.net.id/community/media/visual/2020/05/06/17e52c71-aa32-4a30-a1e1-9b512a5f5b0e_169.jpeg?w=700&q=90
doc_00207,Detik-Inet,https://inet.detik.com/games-news/d-5005494/baru-forza-street-game-balap-gratis-untuk-android-dan-ios,"Baru! Forza Street, Game Balap Gratis untuk Android dan iOS","Microsoftakhirnya merilis Forza Street diAndroiddaniOS, setelah game ini dirilis diWindows 10beberapa waktu lalu.
Forza Street adalah 'saudara' dari game balap andalan Microsoft yang lain, yaitu Forza Horizon dan Forza Motorsport. Namun bedanya di Forza Street pemainnya diajak untuk terjun ke dalam kehidupan pebalap jalanan di Miami, Amerika Serikat.
Tujuan utama di game ini adalah melengkapi koleksi mobil dan tentunya memenangkan balapan yang ada. Turn 10 Studios -- pembuat game ini -- juga mengimplementasiakn kontrol khusus untuk Forza Street yang berfokus pada kontrol yang halus.
Meski berbeda dibanding saudaranya, Forza Street merupakan langkah menarik dari Microsoft membawa seri Forza yang tenar untuk merambah dunia game mobile, demikian dikutip detikINET dari The Verge, Kamis (7/5/2020).
Namun tentu Forza Street akan menghadapi sejumlah nama yang sudah tenar di ranah game mobile. Seperti Real Racing dan seri Asphalt yang sudah ada sejak lama baik di Android maupun iOS.
Microsoft juga punya sejumlah promosi untuk para pemain baru Forza Street. Untuk yang bermain dari sejak game ini dirilis sampai 5 Juni mendatang akan mendapat Ford GT yang unik.
Sementara untuk yang bermain di perangkat Samsung dan mengunduhnya dari Galaxy Store akan mendapat Ford Mustang GT 2015 dengan warna bertema Galaxy, atau sebuah Chevrolet Corvette Z06 2015 untuk pengguna yang menggunakan lini Galaxy S20, lengkap dengan sejumlah kredit in game dan bermacam barang lain.
Forza Street juga bisa dihubungkan ke Xbox Live, jadi pemainnya bisa mensinkronisasikan pencapaiannya di game ini antara iOS, Android dan Windows 10.",07 Mei  2020 07:45,https://akcdn.detik.net.id/community/media/visual/2020/05/06/faab3b2c-130c-4813-af7d-143acea45408_169.webp?w=700&q=90
doc_00208,Detik-Inet,https://inet.detik.com/games-news/d-5006352/pemain-fortnite-lebih-banyak-dari-rakyat-indonesia,Pemain Fortnite Lebih Banyak dari Rakyat Indonesia,"Epic Gamesmengklaim kiniFortnitepunya lebih dari 350 juta pemain terdaftar. Angka tersebut jauh lebih banyak ketimbang jumlah rakyat Indonesia saat ini, yakni 267,7 juta.
Dengan jumlah tersebut membuat Fortnite masuk ke jajaran game terpopuler sepanjang mas. Sayangnya Epic tak mengungkap data mengenai berapa banyak pengguna yang login setiap hari atau bulan di game tersebut.
Namun menurut Epic, sepanjang April, secara total pemain Fortnite login selama 3,2 miliar jam.
Pada Maret 2019 lalu, Epic mengumumkan ada 250 juta pemain terdaftar di Fortnite. Ini artinya jumlah pemain di game tersebut masih tumbuh setelah lebih dari 2,5 tahun sejak pertama dirilis.
Penyebabnya mungkin adalah game ini tersedia di semua platform, PC, konsol, dan mobile. Epic pun terus memperbarui ketersediaan game ini untuk mendukung platform terbaru, demikian dikutip detikINET dari The Verge, Jumat (8/5/2020).
Selain itu, mereka pun terus menambah fitur maupun mode baru di Fortnite. Contohnya yang terbaru adalah mereka menambahkan 'party royale', sebuah ruang sosial bebas senjata yang ada di game tersebut.
Di ruang sosial tersebut pemain bisa login dan berkumpul dengan teman-temannya untuk menonton konser, melakukan bermacam aktivitas ala theme park, dan lainnya. Epic sendiri memang bertujuan untuk membangun sebuah jejaring sosial bergaya metaverse, yang 'hidup' dalam dunia tiga dimensi.",08 Mei  2020 06:02,https://akcdn.detik.net.id/community/media/visual/2019/07/29/44de8841-e4b1-4223-ab35-3c6eb4e56ae3_169.jpeg?w=700&q=90
doc_00209,Detik-Inet,https://inet.detik.com/games-news/d-5006373/animal-crossing-genjot-penjualan-nintendo-switch,Animal Crossing Genjot Penjualan Nintendo Switch,"PenjualanNintendo Switchmeroket 34% pada kuartal terakhir dibanding periode yang sama tahun sebelumnya, dengan penjualan sebesar 3,29 juta unit.
AdalahAnimal Crossing: New Horizonsyang menggenjot penjualan Switch meskipandemi Coronamembuat produksi mereka terhambat. New Horizons, menurut Nintendo terjual 13,41 juta kopi dalam enam minggu pertamanya.
New Horizons memang sejak awal sudah terlihat bakal menjadi game yang bersinar. Penjualannya dalam tiga hari pertama sejak diluncurkan jauh lebih tinggi dari semua game Switch lain yang pernah ada, ataupun game Animal Crossing lain yang sebelumnya sudah diluncurkan.
Secara total, Nintendo mengapalkan 21 juta unit Switch pada tahun fiskal mereka yang baru berakhir. Lebih tinggi prediksi sebelumnya sebesar 18 juta, demikian dikutip detikINET dari Reuters, Jumat (8/5/2020).
Secara total, penjualan Switch di seluruh dunia mencapai 55,77 juta unit, lebih sedikit 20 juta unit dibanding 3DS. Nintendo memprediksi kalau mereka akan menjual 19 juta unit Switch pada 31 Maret 2021 mendatang, atau bisa dibilang puncak dari siklus Switch tersebut.
Pemasukan Nintendo tahunan meningkat 9% dibanding tahun sebelumnya menjadi 1,3 triliun yen. Namun mereka memprediksi kalau tahun depan pemasukannya akan sama seperti 2019 lalu, yaitu 1,2 triliun yen.
""Sepertinya produksi yang tertunda dan pengapalan produk sudah mulai pulih. Namun kami mungkin masih terdampak jika ada masalah pasokan komponen penting. Lebih lanjut, jika dampakCOVID-19masih berlanjut atau malah lebih buruk, hal tersebut akan memperburuk pasokan produk,"" tulis Nintendo dalam laporan keuangannya.",08 Mei  2020 07:32,https://akcdn.detik.net.id/community/media/visual/2020/03/26/d3090668-e611-455e-bb7e-06866e7a611d_169.jpeg?w=700&q=90
doc_00210,Detik-Inet,https://inet.detik.com/games-news/d-5006497/assassins-creed-valhalla-jadi-game-andalan-xbox-series-x,Assassin's Creed: Valhalla Jadi Game Andalan Xbox Series X,"Microsoftmengumumkan deretan video game perdana buatan pihak ketiga yang bakal dioptimalkan untuk konsol terbarunya,Xbox Series X. Salah satunya yang menonjol adalahAssassin's Creed: Valhalla besutan Ubisoft.
Dalam konferensi pers live stream seperti dikutipdetikINETdari BBC, ditayangkan adegan terbaru dari Assassin's Creed: Valhalla walaupun banyak yang komplain lantaran durasinya terlalu pendek dan tidak terlalu menunjukkan seperti apa gameplay-nya.
Direktur Kreatif Assassin's Creed: Valhalla, Ashraf Ismail, menyatakan bahwa Xbox Series X bakal menghadirkan peningkatan signifikan bagi para gamer termasuk di game buatannya itu.
""Assasin's Creed selalu berkomitmen pada teknologi baru untuk memacu pengalaman paling imersif yang kami bisa. Dengan waktu loading luar biasa cepat (di Xbox Series X), kami bisa menghilangkan beberapa gangguan,"" kata dia.
Kemudian ada Dirt 5 yang nantinya memungkinkan gamer bermain di resolusi ultra HD 4K 60 fps. Lalu ada game horor The Medium, yang akan memanfaatkan optimal kapabilitas Xbox Series X menghadirkan efek cahaya memukau.
Game lainnya termasuk Yakuza: Like a Dragon, Madden NFL 21, Vampire: The Masquerade - Bloodlines 2, Bright Memory Infinite, Call of the Sea, Scarlet Nexus, Chorus, Scorn, Second Extinction, serta The Ascent.
""Ratusan game lagi sudah dalam pengembangan untuk Xbox Series X, terima kasih pada komunitas mitra kami yang luar biasa. Kami akan membagikan lebih banyak lagi dalam bulan-bulan mendatang,"" cetus Microsoft.
Microsoft belum membocorkan harga maupun tanggal pasti peluncuran Xbox Series X, kisarannya adalah menjelang akhir tahun 2020 ini. Tak menutup kemungkinan waktunya sama dengan rilis saingan beratnya, PlayStation 5 dari Sony. Oh ya, berikut trailer terbaru Assassin's Creed: Valhalla:",08 Mei  2020 09:32,https://akcdn.detik.net.id/community/media/visual/2020/05/08/4afb1a97-2b3e-4cf4-9cef-ceda777fce49.png?w=700&q=90
doc_00211,Detik-Inet,https://inet.detik.com/games-news/d-5006679/5-game-mobile-seru-buat-ngabuburit,5 Game Mobile Seru buat Ngabuburit,"Bermain game mobile bisa menjadi selingan kegiatan ngabuburit menunggu waktu buka puasa. Ada beberapa pilihan game seru yang sedang jadi favorit para gamers saat ini.
Mayoritas game mobile populer dimainkan secara online dengan konsep multiplayer. Kamu bisa mengajak teman main bareng (mabar) supaya semakin seru.
Berikut ini rekomendasi game mobile yang seru dimainkan sambil ngabuburit, yang dimainkan dengan modal smartphone dan koneksi internet.
1. Mobile Legends
Game bergenre Moba ini dimainkan multiplayer, mempertemukan dua tim setiap match-nya. Kedua tim beradu kuat untuk saling menghancurkan benteng pertahanan lawan. Pilihan hero yang bervariasi beserta skin uniknya menjadi daya tarik dari game ini. Para pemain Mobile Legend dibuat terbacu untuk meningkatkan ranking individualnya dengan memenangkan banyak pertarungan.
2. PUBG Mobile
Game bergenre battle royale ini dapat dimainkan solo ataupun grup. Dalam permainan ini, 100 pemain diterjunkan di sebuah pulau untuk bertempur memperebutkan kemenangan. Pemain mesti mengambil senjata, kendaraan, serta persediaan amunisi untuk menaklukkan lawan. Pertempuran semakin sengit ketika jumlah petarung semakin sedikit dan zona bermain mengecil.
Dalam game ini ada berbagai jenis senjata, mulai dari senapan, pistol, pisau, sampai wajan pun ada. Skin player juga banyak pilihan, menjadi daya tarik untuk membuat tampilan player sesuai selera.
3. Free Fire
Free Fire merupakan game battle royale lainnya yang digilai gamers di masa ini. Konsep permainan dari game ini mirip-mirip dengan PUBG Mobile. Bedanya, di Free Fire hanya ada 50 orang dalam satu medan pertempuran dan kontrol lebih sederhana. Free Fire juga dapat dimainkan solo maupun grup.
4. Call of Duty Mobile
Penyuka genre battle royale juga bisa memilih Call of Duty. Berbeda dengan PUBG dan Free Fire yang menerapkan konsep third person shooter, COD menggunakan konsep first person shooter, memberikan visual realistis saat bertarung dengan lawan. Terdapat dua mode yang dapat dimainkan, yakni battle royale dan multiplayer. Pada mode battle royale, pemain harus bertarung dengan 99 pemain lain, sementara pada model multiplayer pertarungan melibatkan dua tim yang masing-masing beranggotakan lima orang
5. PES 2020
Menyimpang dari keempat game sebelumnya yang bernuansa pertempuran, PES 2020 cocok untuk para penyuka sepakbola. Di game ini, pemain memilih satu tim untuk dimainkan hingga menaikan level tim dengan membeli pemain, melatih pemain, hingga memilih pelatih yang punya strategi terbaik. Game ini juga bisa dimainkan multiplayer.
Untuk memainkan game-game tersebut, dibutuhkan perangkat yang mumpuni. OPPO A92 bisa jadi pilihan, karena smartphone tersebut memiliki performa andal,.
OPPO A92 menggunakan chipset Qualcomm Snapdragon 665, ROM 128 GB, dan RAM 8GB yang mampu menjalankan game dengan cepat. Smartphone ini juga memiliki teknologi Hyper Boost yang mendukung bermain game menjadi semakin lancar.
OPPO mengajak konsumen berdonasi setiap pembelian produk melalui program #SejernihDepanMata yang berlangsung selama 1-31 Mei 2020. Informasi lengkap mengenai cara berdonasi dapat dilihatdi sini.",08 Mei  2020 11:40,https://akcdn.detik.net.id/community/media/visual/2020/05/08/f7780326-579f-4f4d-9ac7-b51073bad19a_169.png?w=700&q=90
doc_00212,Detik-Inet,https://inet.detik.com/games-news/d-5007016/tokyo-game-show-2020-lirik-opsi-hajatan-online,Tokyo Game Show 2020 Lirik Opsi Hajatan Online,"PenyelenggaraTokyo Game Show 2020masih mencari cara untuk tetap menggelar hajatan tahunannya tersebut yang harus batal karena pandemiCorona. Bisa jadi, Tokyo Game Show 2020 akan digelar online.
Pembatalan Tokyo Game Show tahun ini tentu saja menyedihkan para penggemarnya. Sejak pertama kali digelar pada 1996, ajang berkumpulnya gamer dan pelaku industri game dari seluruh dunia ini belum pernah batal digelar.
Jadi, seperti dikutip dari Slash Gear, ini adalah yang pertama kalinya dalam 23 tahun, gelaran Tokyo Game Show 2020 ditiadakan. Bahkan jika acara ini dijadwalkan berlangsung akhir September pun, pandemi COVID-19 tetap tidak memungkinkan untuk memprediksi berapa lama pembatasan akan diberlakukan.
Ini mungkin merupakan pukulan besar bagi perusahaan yang mengandalkan acara-acara game besar sebagai panggung perkenalan produk terbarunya. Di antara perusahaan tersebut misalnya ada Sony dan Microsoft yang sudah jauh hari menyiapkan generasi terbaruPlayStationdan konsol Xbox.
Biasanya, mereka akan menjadwalkan penampilan ke publik sebelum konsol besutannya mulai dijual untuk memeriahkan musim liburan akhir Natal dan Tahun Baru. Mau tidak mau, perusahaan-perusahaan ini sekarang harus puas hanya dengan menggelar peluncuran online.
Penyelenggara Tokyo Game Show sendiri sejauh ini belum memberikan rincian lebih lanjut tentang acara tersebut. Kalaupun akan menggelar Tokyo Game Show secara online, panitia acara harus bekerja lebih keras mengingat peserta pameran berasal dari seluruh dunia.
Selain itu, andai jadi digelar online, ini akan jadi pertama kalinya sebuah hajatan akbar berpindah platform dan akan menyulitkan mengemas semua presentasi perusahaan dan developer game dalam sebuah acara virtual.
Kita tunggu saja, menarik juga kalau acara sebesarTokyo Game Showdigelar online. Menurut kalian bagaimana?",08 Mei  2020 20:08,https://akcdn.detik.net.id/community/media/visual/2017/09/23/446a236f-b272-4466-acf0-721a4300ad3e.jpg?w=700&q=90
doc_00213,Detik-Inet,https://inet.detik.com/games-news/d-5007022/makin-populer-facebook-gaming-bikin-banyak-event-di-indonesia,"Makin Populer, Facebook Gaming Bikin Banyak Event di Indonesia","Facebook Gamingmenjadi platform layanan live stream game lainnya yang popularitasnya menanjak saat ini. Tidak hanya di kancah global, tapi juga di Indonesia.
Head of Southeast Asia, APAC Games Partnership Facebook Michael Rose mengatakan sejak hadir di Indonesia pada tahun 2018, Facebook Gaming telah tumbuh secara signifikan.
""Indonesia adalah salah satu pasar terdepan kami secara global dan di Asia Tenggara, yang saya rasa cukup keren, dan juga salah satu yang tumbuh paling pesat,"" kata Rose dalam konferensi pers virtual, Jumat (8/5/2020).
Ini bisa dilihat dari jumlah penonton konten video gaming yang melonjak 210% dibanding tahun lalu. Ada limagameyang populer di kalangan gamer dan kreator di Facebook Gaming Indonesia yaitu Mobile Legends, PUBG Mobile, Free Fire - Battlegrounds, Grand Theft Auto V dan Free Fire.
Popularitas yang terus menanjak ini mendorong Facebook Gaming untuk mengadakan lebih banyak event di Indonesia. Untuk menemani saat bulan Ramadhan ini saja, mereka telah menyiapkan tiga event online.
Event pertama adalah donasi untuk tenaga medis yang berada di garda depan melawan virus Corona. Saat melakukan streaming, kreator bisa meminta penonton mereka untuk menyumbang lewat Kitabisa.com. Program ini berjalan dari April hingga akhir Mei 2020.
Facebook Gamingjuga mengadakan kampanye global di bulan Ramadhan. Untuk menyatukan kreator dari Indonesia, Malaysia, Turki dan Timur Tengah, Facebook Gaming akan mengadakan laga persahabatan menggunakan fitur Tournament yang baru saja diluncurkan.
Ada juga maraton livestream di mana penggemar bisa menonton kreator favorit mereka melakukan live streaming dari buka puasa hingga waktu sahur. Agar suasana Ramadhan lebih terasa, Facebook Gaming juga meluncurkan overlay dan gift virtual khusus bertema Ramadhan.
Facebook Gamingjuga akan mengadakan event besar pada Juni mendatang bertajuk Creator Games Battle of Heroes. Turnamen berskala internasional ini akan mencakup ratusan kreator di kawasan Asia Pasifik.
""Kita akan memiliki 108 tim, lebih dari 400 kreator dan enam negara yang berpartisipasi, jadi kita sangat gembira dengan turnamen ini,"" pungkas Rose.",08 Mei  2020 14:51,https://akcdn.detik.net.id/community/media/visual/2019/03/14/730fb292-1838-4f58-9cf5-9f5ff8a4baed_43.jpeg?w=700&q=90
doc_00214,Detik-Inet,https://inet.detik.com/games-news/d-5007063/bedanya-facebook-gaming-dengan-layanan-streaming-game-lainnya,Bedanya Facebook Gaming dengan Layanan Streaming Game Lainnya,"Facebook Gamingtermasuk pemain baru di kancah live streaming game. Sebelumnya telah ada platform sepertiTwitchdanYouTube Gamingyang telah berhasil menggaet gamer dan kreator papan atas.
Facebook Gaming juga mulai meningkatkan kehadirannya di Asia Tenggara, terutama Indonesia. Tapi, apa yang membuat platform ini berbeda dibanding kompetitornya?
Head of Southeast Asia, APAC Games Partnership Facebook Michael Rose mengatakan Facebook Gaming lebih fokus untuk mengembangkan komunitas game yang ada. Hal ini juga yang menjadi misi mereka.
""Kami mengadakan event offline dan online secara reguler untuk menyatukan kreator dan penggemarnya,"" kata Rose dalam konferensi pers virtual, Jumat (8/5/2020).
""Kami menghabiskan banyak waktu dan sumber daya untuk event tersebut karena kami percaya menciptakan ikatan yang kuat antara komunitas kreator merupakan sesuatu yang penting,"" sambungnya.
Setiap bulannya, lebih dari 700 juta orang berinteraksi dengan konten gaming diFacebook. Per Maret 2020, ada 160 juta pengguna aktif bulanan yang bergabung dalam 450 ribu grup gaming di Facebook.
Selain itu, Rose mengatakan Facebook Gaming memiliki keunggulan karena bisa mengandalkan basis pengguna Facebook yang merupakan media sosial terbesar di dunia. Sehingga Facebook Gaming tidak hanya bisa menggaet gamer untuk menjadi audiens tapi juga pengguna lainnya yang sifatnya lebih umum.
Hal ini yang mendorongFacebook Gaminguntuk hadir dalam berbagai versi di banyak platform, mulai dari tab khusus di situs utama Facebook hingga aplikasi khusus untuk Android yang baru saja diluncurkan beberapa waktu yang lalu.
""Jadi kami memiliki banyak cara untuk menonton konten, jadi kalian bisa menonton konten gaming yang lebih umum dan kalian juga memiliki tempat khusus untuk menonton konten,"" pungkasnya.",08 Mei  2020 16:31,https://akcdn.detik.net.id/community/media/visual/2020/05/08/a6060080-fea6-468c-a7ed-f05ce22b1a0b_43.jpeg?w=700&q=90
doc_00215,Detik-Inet,https://inet.detik.com/games-news/d-5007081/3-cara-gamer-bisa-dapat-cuan-lewat-facebook-gaming,3 Cara Gamer Bisa Dapat Cuan Lewat Facebook Gaming,"Menjadi kreator konten, apalagi kontengaming, biasanya menjadi impian banyak anak muda. Bagaimana tidak, dengan memainkangamefavorit sehari-hari bisa ditonton banyak orang dan menghasilkan pendapatan yang tidak sedikit.
Saat ini sudah banyak platform streaming game yang bisa dipilih oleh gamer dan kreator untuk membagikan kontennya, termasukFacebook Gaming. Untuk mendapatkan cuan di Facebook Gaming, kreator bisa menggunakan tiga metode yaitu iklan, Stars dan Fan Support.
Head of Southeast Asia, APAC Games Partnership Facebook Michael Rose mengatakan iklan yang ditampilkan diFacebook Gamingberupa gambar dan video yang tidak akan mengganggu jalannya stream. Sedangkan Stars merupakan cara penggemar untuk memberikan tip kepada kreator favoritnya.
""Penggemar bisa membeli Stars dan mengirimkannya kepada kreator untuk menunjukkan dukungan mereka, seperti misalnya setelah kreator memenangkan pertandingan atau sekedar apresiasi hiburan menarik yang baru saja ditonton,"" kata Rose dalam konferensi pers virtual, Jumat (8/5/2020).
Kedua, penggemar juga bisa mengirimkan pesan bersama dengan Stars yang mereka kirimkan. Nantinya kreator bisa membaca pesan ini dan memberikan shoutout untuk penggemar yang telah memberikan tip.
Terakhir yang ketiga, ada Fan Support yang memungkinkan penggemar untuk memberi dukungan kepada kreator setiap bulannya. Konsepnya mirip dengan berlangganan streaming musik dan video, jadi kreator akan mendapatkan uang dari penggemar secara rutin setiap bulannya.
""Penggemar bisa melakukan ini dan mendapat hadiah khusus seperti konten eksklusif khusus untuk pendukung, stiker khusus untuk pendukung atau bergabung di grup penggemar khusus,"" jelas Rose.
Selain itu, kreator juga bisa bergabung menjadi kreator resmi diFacebook Gaming. Untuk menjadi kreator resmi di Facebook Gaming, ada dua program yang harus diikuti yaitu Level Up dan Partner.
Program Level up biasanya diikuti oleh mereka yang baru memulai dan ingin membangun komunitasnya. Sedangkan Partner diperuntukkan kepada kreator yang namanya mulai dikenal luas.
""Jadi mereka mendaftar program Level Up untuk berkembang dan mengakses fitur yang ada. Akhirnya mereka bisa masuk ke program Partner untuk menjadi partner resmi kami,"" pungkas Rose.",08 Mei  2020 18:18,https://akcdn.detik.net.id/community/media/visual/2020/04/20/222156ce-d020-4a7b-a6fd-49316ff7f2b5_43.jpeg?w=700&q=90
